text,labels
"No..., I I dont have time go Arlington on Saturday  .",2
When should we meet on Monday go get Baby Gap go Los Angeles  ?,2
agree   nine day in advance.  .,1
Sorry.  I'm busy...    postpone  eleven day .,0
You free  go Glendale  on Wednesday  ?,2
Want to go get Magnum  late for 4 year  ?,0
What day should we meet go get Andy Capp's fries go Springfield on Sunday  ?,2
How about  go Fayetteville 10 day advance.   ?,1
No.  I'm busy...  late for 10  week Bud Light go Huntsville .,0
What day should we meet tomorrow go Madrid   ?,2
Want to suspend  five  week go Lyon LEonidas  ?,0
When should we meet on Monday  go Wien  ?,2
Do you want  hold up for  eihgt year go buy Eggs  ?,0
What time should we meet hold up for  five month    ?,0
Where we 3  week advance. go get Blue Moon   ?,1
of course not I'm busy.  today   .,2
What day should we meet on Thursday    ?,2
Are you free  delay for   ten day    ?,0
Are you busy   hold up for  five day   ?,0
Where go Fayetteville on Monday go buy Knorr  ?,2
Where we   3  week advance.  ?,1
What time should we meet    seven month before.  ?,1
Where we  go Reno defer  four year  ?,0
What time should we meet  on Tuesday   ?,2
Sure.  go buy Keystone Light  on Monday .,2
How about     eleven day prior.  ?,1
Shall we go get Grolsch the day after tomorrow go Tulsa  ?,2
go where 6 day after go get Fish   ?,0
You free on Saturday Frozen foods   ?,2
Are you free at go Scottsdale on Saturday   ?,2
what day to advance 10 day    ?,1
Do you want go Tallahassee postpone 4  week   ?,0
Where do you want   nine year in advance. go Denver  ?,1
Are you free   go Bridgeport on Thursday  ?,2
You free  suspend 8 day  go San Diego  ?,0
Are you free at  postpone 3 month   ?,0
Yes on Monday  go get Six Deuce .,2
True dat   to advance  seven  week .,1
What day should we meet go Saint Paul  delay for  1 month  ?,0
no way  I'll be out of town. late for  nine day go buy Juicy Juice  .,0
Why not go buy Lee  on Friday  ?,2
what time  Ecko Unlimited on Wednesday  ?,2
What place go buy Loyandford  delay for  one  week  ?,0
Where we  eihgt day early go buy Dry Goods   ?,1
"No..., I  I'll be out of town.  go Pittsburgh  five year before. .",1
Sure.  go buy Jack Daniels go Reno defer  four year .,0
what day on Monday  Brooks Brothers  ?,2
How about  see Black Panther  the day after tomorrow  ?,2
You free  go Fayetteville Fruits delay for   five month  ?,0
go where hold up for  three year go Pittsburgh   ?,0
OK 1 year later go Glendale  .,0
Are you busy  go buy Eggs go Indianapolis 1  week advance.  ?,1
When should we meet go Kansas City   four year early  ?,1
Why not  7 day before.   ?,1
what day  four day earlier. go Glendale go buy Brahma  ?,1
Sure!   see Transformers postpone  seven day .,0
Are you free  Koalapop on Tuesday   ?,2
Where we Mohito  defer  eihgt month  ?,0
what day go buy Eggs  1  week advance.  ?,1
not  I'll be out of town. go buy Wendy's  on Monday .,2
What time should we meet go Glendale  postpone  four month  ?,0
yeah tomorrow Kinder go Indianapolis .,2
Do you want  go buy Strongbow on Saturday  ?,2
Do you want  go Sacramento tomorrow  ?,2
alright   nine  week prior.  .,1
not  I have plans already.    on Wednesday .,2
Do you want 1 year earlier.    ?,1
What time should we meet  tomorrow go buy Bakery products  ?,2
don't I'm busy.  go Springfield 10 day after  .,0
Yes 3 day after   .,0
Why not go Murfreesboro go get Bel Group tomorrow  ?,2
Let's  today  go buy Dry Goods  ?,2
What time should we meet  go buy LEonidas today  ?,2
How about   9  week in advance. go Baltimore  ?,1
k 7 year prior. go Springfield go buy Pepsi .,1
Of course 3 month later go Albuquerque go buy Healthtex .,0
Where we   move to  four month  ?,0
Where do you want   1  week early  ?,1
When  go buy Taco Bell  late for 3 day  ?,0
No. I'm busy...  hold up for 6 day  Baby-care .,0
No. I dont have time   on Monday .,2
Do you want go Irving   six month early  ?,1
Why not  nine  week in advance.  go Laredo  ?,1
Are you free at move to  four month Evian   ?,0
Are you busy  go Indianapolis suspend  ten year Kinder  ?,0
Where do you want Flowers go Tulsa  ten month prior.  ?,1
Why not  delay for  3 month   ?,0
You free  go Kansas City postpone 3 year  ?,0
what time Max Studio go Glendale on Wednesday  ?,2
Want to   today  ?,2
That's right  three day earlier.   .,1
Yep go Saint Paul go get Cappy tomorrow .,2
Why not Mataano  the day after tomorrow  ?,2
What time should we meet go get Burger King today   ?,2
Where we  late for  nine day   ?,0
what day Poultry tomorrow   ?,2
Where should go Springfield  two  week in advance.   ?,1
Would you see Blood Diamond go Oakland  eleven month before.  ?,1
what time Koalapop on Tuesday go Nashville  ?,2
You free  go get Kits go Stockton the day after tomorrow  ?,2
What day should we meet one year before.  go Rome  ?,1
Why not go buy Tic Tac defer  three month   ?,0
don't I can't.  go New Orleans  today .,2
Where we meet 10 day earlier. go Omaha go buy Diet foods  ?,1
When  on Tuesday  go get Medicines  ?,2
Want to to advance 5 day go get Mustard go New Orleans  ?,1
Where we meet go Escondido  move to  nine  week  ?,0
what time go Indianapolis move to 10 day go get Secret Recipe  ?,0
You free go get Secret Recipe  on Wednesday  ?,2
okay on Tuesday  go buy Dr. Oetker .,2
What day should we meet on Sunday go Rome   ?,2
Nah  I dont have time  go Bridgeport on Thursday .,2
Why not Deep River Rock one year early go Lisbon  ?,1
alright   postpone 3 year .,0
Why not go Charlotte Kits the day after tomorrow  ?,2
No.  I'm busy.  go Tulsa postpone  eihgt  week  .,0
You free   late for  four year  ?,0
That's right  go get Cosmetics 4 month earlier. .,1
True dat on Tuesday go New Orleans  .,2
Where should Bel Group go Oakland on Monday  ?,2
How about  go get SABA on Tuesday go Berlin  ?,2
You free go buy Highland Spring delay for   seven month go Denver  ?,0
Where do you want defer  nine month    ?,0
What time should we meet  7 month in advance. go Zurich  ?,1
When should we meet   on Monday  ?,2
Would you go Jersey City postpone  seven day see Transformers  ?,0
of course not I can't.  go Tallahassee   ten day early .,1
You free    on Monday  ?,2
Are you busy  tomorrow Kinder go Indianapolis  ?,2
When should we meet  on Saturday Wendy's  ?,2
When should we meet  go get Kinder tomorrow  ?,2
Yup Hamilton Shirts postpone 4  week go Tallahassee .,0
Are you free at 5 year advance.  go El Paso  ?,1
You free go Springfield on Thursday   ?,2
exactly  five  week advance.   .,1
Nice on Thursday go Bakersfield  .,2
What day should we meet go buy Brahma go Escondido  eleven month later  ?,0
Yup on Wednesday go Valetta  .,2
Sounds good.   9 month advance. go Prague .,1
You free    delay for   ten  week  ?,0
"No..., I I'm busy...  10 day earlier. go Omaha  .",1
Why not  go get Burger King 2 year ahead.  ?,1
Are you busy  the day after tomorrow Granini go Innsbruck  ?,2
k delay for  2 month go Sacramento  .,0
don't I'm busy.  go Springfield   three day before. .,1
Where we  go Philadelphia tomorrow  ?,2
nope  I'll be out of town.    eihgt  week early .,1
OK!  Baby food  2 month ahead. .,1
True dat go get Kits go Stockton the day after tomorrow .,2
don't I dont have time White rice go Detroit on Wednesday .,2
Want to  three  week ahead. go buy Blue Moon go Toledo  ?,1
Let's  Bel Group postpone  nine month   ?,0
Do you want go Los Angeles  eleven  week after   ?,0
When should we meet 1 month earlier.  go buy Baby-care  ?,1
How about  go Bridgeport  on Tuesday  ?,2
Are you busy  LEonidas go Lyon  twelve day before.  ?,1
How about  on Thursday    ?,2
What place M&M Food Market hold up for  three  week go Valetta  ?,0
Why not  defer 8 day   ?,0
No. I'm busy...  tomorrow go Philadelphia Baby-care .,2
When should we meet    eleven month before.  ?,1
You free   seven month advance. go buy Nesquik go Wien  ?,1
okay  1 month advance. go Oakland .,1
 I can't.  hold up for 6 year go buy Knorr go Fayetteville .,0
Good go buy Converse defer  six  week  .,0
Yep  ten year before. go buy C&A go Escondido .,1
don't  I have an appointment.  go get Bread today  .,2
Sorry I dont have time on Wednesday go buy Sun-Pat  .,2
k on Saturday go Quebec go buy Pepsi .,2
Why not go New Orleans  to advance  two day  ?,1
what time go Denver suspend one year go buy Tanqueray  ?,0
Yep   eleven day in advance. go buy Evolution Fresh .,1
No.  I dont have time on Wednesday   .,2
Why not go Santa Ana  two day ahead. go get Pasta  ?,1
Would you  to advance 9 month go Arlington  ?,1
What day should we meet  five month after go Springfield go get Andy Capp's fries  ?,0
what day  go buy Candies to advance  six day  ?,1
What place  9 month after   ?,0
Want to  White rice 1  week early  ?,1
go where  one day earlier.   ?,1
Are you free at go Washington on Monday   ?,2
no way I dont have time  go Albuquerque tomorrow .,2
Let's   tomorrow   ?,2
Sure!  10 month ahead. Cross Colours go Miami .,1
No.  I'm busy.   six day prior. go London Evian .,1
Are you free at delay for  9 year Johnnie Walker go San Antonio  ?,0
Where should go Columbus on Sunday go buy Forever Lazy  ?,2
of course go Charlotte see The Notebook on Thursday .,2
You free on Saturday go Nashville go buy JNCO  ?,2
Want to  go buy Ground turkey 1 year later  ?,0
Shall we 9  week prior.    ?,1
Want to Bel Group  four year after   ?,0
What day should we meet  three year early    ?,1
No.   I'll be out of town. 10 day later  Olymel .,0
When  Bud Light   nine day early  ?,1
nope  I have plans already.  defer 10 year   .,0
Let's  on Thursday  go get Flowers  ?,2
Why not on Saturday go Lisbon   ?,2
Why not the day after tomorrow go Innsbruck   ?,2
Let us suspend 8 day  go San Diego  ?,0
What place   twelve year ahead. go Oakland  ?,1
You free go Springfield go buy DKNY 5 month earlier.  ?,1
Are you free at go get Bewley's  three day in advance.   ?,1
Why not  one day later go Long Beach  ?,0
of course not I can't.  on Saturday   .,2
Why not 6 day after go Bucharest go get Fish  ?,0
When  4  week prior.    ?,1
what time move to 6 year go Bakersfield go get Edelweiss  ?,0
Let us on Tuesday  go Oakland  ?,2
Where we go San Diego  six day early DKNY  ?,1
Let's  Absolut 10 day after go Springfield  ?,0
You free move to 10 day  go Indianapolis  ?,0
Let us go get Cappy 7  week advance. go Washington  ?,1
"No..., I I can't.   the day after tomorrow go San Diego .",2
Sounds good.  postpone  three day   .,0
Would you go Kansas City Applebee's postpone 3 year  ?,0
That's right go Wien hold up for 8 day go buy Nesquik .,0
no  I have plans already.     ten month later .,0
Would you go El Paso on Tuesday go get Bel Group  ?,2
Let's   on Wednesday   ?,2
What location    three year before.  ?,1
When should we meet go buy Lee move to 5 day   ?,0
yeah go Ontario on Sunday  .,2
Let's  go San Diego today   ?,2
Where should  the day after tomorrow   ?,2
Where do you want go get Magnum go Hayward today  ?,2
 I dont have time go Fort Lauderdale to advance  six day go buy Candies .,1
don't I'm busy...  go New Orleans  to advance 5 day .,1
Let us  four day early go New York   ?,1
Yep  7 year after  .,0
Sure.    four  week earlier. go Bucharest .,1
can't  I have an appointment.   go Reno  twelve  week before. .,1
Why not delay for  3 month go buy Evolution Fresh   ?,0
When  go St. Louis on Wednesday see Pretty Woman  ?,2
Want to  five  week advance.    ?,1
What day should we meet go get Knorr go New Orleans today  ?,2
What day should we meet one year before.  go get Bacardi  ?,1
Where we meet on Monday go Pittsburgh go buy Grolsch  ?,2
You free go Columbus hold up for  eleven month go buy Forever Lazy  ?,0
Would you Ex-Boyfriend on Saturday go Moreno Valley  ?,2
That's right go Lincoln  on Tuesday .,2
Are you free  3 year advance.    ?,1
what time on Wednesday    ?,2
Where do you want   on Monday  ?,2
How about  go Amarillo 10  week before.   ?,1
What day should we meet  Mustard tomorrow  ?,2
Why not   to advance 1  week  ?,1
no way  I have an appointment.   seven day before. go get McDonald's go Omaha .,1
Do you want  on Tuesday   ?,2
not I can't.   to advance 10 day go Lincoln .,1
what time go Laredo 10 month before.   ?,1
what day hold up for  four day  go Baltimore  ?,0
Would you   postpone 3 year  ?,0
"No..., I  I'll be out of town. 4 year advance. go Fullerton Wendy's .",1
Let us  suspend 8 day   ?,0
no I can't.  go Charlotte see The Notebook one day prior. .,1
Yes  on Monday go Houston .,2
Where we meet go buy Ex-Boyfriend late for  eleven  week   ?,0
OK    four day earlier. .,1
don't  I'll be out of town. go Salem defer one year see Black Panther .,0
go where suspend 7 month go buy Baby-care   ?,0
What time should we meet move to 2 year go get Lee   ?,0
go where Brooks Brothers go Prague 1 year earlier.  ?,1
Want to   suspend 10  week  ?,0
Are you free at   delay for  7 year  ?,0
Where do you want to advance 2 day    ?,1
Shall we  three day ahead.  go get Knorr  ?,1
When  today go Dallas Prigat  ?,2
When  today go Baltimore   ?,2
What day should we meet to advance  four year    ?,1
what day hold up for  four day    ?,0
no I'm busy.   go Denver 5 month before. .,1
How about  7 month advance. go Henderson   ?,1
nope  I have plans already.   on Wednesday go Madrid .,2
Where we meet go Berlin  on Thursday  ?,2
agree  go Wien 1  week prior. .,1
can't wait  eleven year before. see Ice Age 1  .,1
Do you want   9 year early  ?,1
Sure!  Frozen foods  seven month before. go Philadelphia .,1
What day should we meet   today  ?,2
What time should we meet the day after tomorrow  go Tulsa  ?,2
Nah   I'll be out of town. to advance  two  week   .,1
Do you want on Wednesday go buy Sun-Pat   ?,2
Do you want go get Lee go Lincoln 8 day advance.  ?,1
How about  go get Knorr hold up for  eleven  week go Fayetteville  ?,0
Are you free at on Thursday  go get Flowers  ?,2
Nice defer 10 year   .,0
Great.    one year early .,1
Shall we  five  week advance. go buy Tommy Hilfinger   ?,1
What time should we meet go buy Snack foods 9 month advance. go Prague  ?,1
When   hold up for  three  week Deep River Rock  ?,0
What time should we meet go buy Strongbow on Saturday go Los Angeles  ?,2
Why not go San Jose  hold up for 9 year  ?,0
How about    10 day advance.  ?,1
Nice see Pretty Woman 4  week in advance. go St. Louis .,1
Where we meet Heinz 10  week before. go Amarillo  ?,1
Where we  Baby-care tomorrow  ?,2
How about  go Portland  1 month early  ?,1
What place on Monday go Zurich   ?,2
OK go Zurich Cheese hold up for  five month .,0
What time should we meet  go Santa Ana delay for   three year  ?,0
Where should on Thursday    ?,2
True dat Heinz 10  week before. go Amarillo .,1
Why not   8  week in advance.  ?,1
okay  go Innsbruck  four year after .,0
What time should we meet  six year early go Charlotte Mohito  ?,1
don't  I'll be out of town.  3 month earlier. go Salem .,1
You free    hold up for 8 day  ?,0
Where  9 year early Heinz  ?,1
Sure.  on Sunday  go San Diego .,2
What day should we meet go get Cosmetics go Dallas postpone  eleven day  ?,0
No. I dont have time go Oakland   eihgt  week after .,0
Where we meet  go Stockton the day after tomorrow  ?,2
What time should we meet go Garland  defer  three month  ?,0
Are you busy    3 month later  ?,0
What day should we meet go Anaheim suspend  ten  week   ?,0
What place go Tulsa tomorrow Poultry  ?,2
Are you busy  on Tuesday go Tulsa   ?,2
k   on Sunday .,2
Would you go Wien move to  ten day   ?,0
Sure!  go Washington  9 year after .,0
Sorry.  I'm busy...  go Anaheim suspend  ten  week  .,0
Are you busy  go Glendale hold up for 8 day   ?,0
what time go Fayetteville 10 day advance.   ?,1
Are you busy  go buy Brahma go Glendale today  ?,2
 I can't.  go Fayetteville go buy Knorr 3 year prior. .,1
Where should on Saturday go Otawa   ?,2
Want to move to 8 month  go get Medicines  ?,0
Why not on Monday  go Innsbruck  ?,2
How about  go buy Dunkin' Donuts defer 9 month   ?,0
When   on Wednesday   ?,2
What place postpone 9  week  go Cincinnati  ?,0
don't  I'll be out of town. on Tuesday  go Oakland .,2
 I dont have time  hold up for 10 year go get Bewley's .,0
When should we meet go Worcester on Sunday   ?,2
Sounds good.  go San Diego  six day early  .,1
go where  go Pittsburgh 7 day earlier.  ?,1
OK  delay for   seven month  .,0
Let us go Fullerton  on Wednesday  ?,2
How about  suspend 6 day    ?,0
What time should we meet Guaranito on Thursday go Springfield  ?,2
What time should we meet   three day in advance.   ?,1
Shall we go Scottsdale late for  eleven  week go buy Ex-Boyfriend  ?,0
Nice see Pretty Woman 4  week in advance.  .,1
Would you go Charlotte Mohito defer  eihgt month  ?,0
What day should we meet 4 year early Magnum go Colorado Springs  ?,1
Want to SABA 5 month early   ?,1
no I can't.  2 month in advance. go Fremont go buy White rice .,1
Why not go Memphis hold up for  ten  week go get Candies  ?,0
What day should we meet    nine year later  ?,0
what time go buy Sweets  eihgt  week after go Oakland  ?,0
Where  suspend 1 year Kits  ?,0
can't I can't.   on Tuesday  .,2
Why not go Cincinnati  4 year early  ?,1
Where   the day after tomorrow  ?,2
How about   late for 3 day   ?,0
"No..., I I can't.   suspend 8 day  .",0
Great.   tomorrow go buy Bakery products .,2
Let us  ten  week advance.  go Quebec  ?,1
Want to the day after tomorrow go Lyon   ?,2
What time should we meet  8  week in advance. go Garland  ?,1
OK!   on Wednesday  .,2
Let's    seven  week early   ?,1
"No..., I  I have plans already.  suspend 6 month   .",0
Why not the day after tomorrow go Scottsdale go get Brooks Brothers  ?,2
When  see Chocolat to advance  two  week   ?,1
don't I can't.  Eggs go Long Beach one day later .,0
Great.    hold up for  three  week .,0
Shall we   eleven month earlier. go Houston  ?,1
what day Brooks Brothers go Prague suspend  eihgt month  ?,0
no way  I'll be out of town. to advance 7  week go Tulsa  .,1
agree  Olymel on Monday .,2
Sorry.  I'm busy...  on Sunday go get Andy Capp's fries  .,2
nope I'm busy.   go Lancaster on Sunday .,2
Are you free at  ten month before. go Bridgeport go get Flowers  ?,1
Where we go get Hygiene products go Arlington to advance 9 month  ?,1
Where do you want move to 10 day  go get Secret Recipe  ?,0
When should we meet   6 year early  ?,1
what day  ten year before. go Escondido   ?,1
Shall we  go Innsbruck suspend  three  week  ?,0
Yup   three year before. go Valetta .,1
of course delay for  one  week go buy Loyandford go Huntsville .,0
Where we meet  twelve day before.  LEonidas  ?,1
  I'll be out of town.    nine year later .,0
Let's  Koalapop on Tuesday   ?,2
Do you want  4  week in advance.   ?,1
What time should we meet 5 month early    ?,1
Shall we  move to  nine day go Murfreesboro  ?,0
What day should we meet  five  week advance.    ?,1
"No..., I I dont have time go buy Lee  on Friday .",2
Yes go Salt Lake City on Tuesday  .,2
What place move to 3 month go buy Blue Moon   ?,0
go where  go Glendale on Wednesday  ?,2
You free  go New York late for  four year  ?,0
alright move to  twelve year go New York Domino .,0
Are you busy  go Reno go buy Jack Daniels on Friday  ?,2
Shall we 9 year earlier. Kinder   ?,1
When should we meet 4 year advance. go Fullerton Wendy's  ?,1
Let's  postpone  nine month    ?,0
What place Guaranito tomorrow   ?,2
Nice   on Thursday .,2
  I'll be out of town. today   .,2
No.  I'm busy.  on Monday   .,2
You free on Monday  go Denver  ?,2
Let us  five month after go get Andy Capp's fries   ?,0
Sounds good.  Prigat 1 day in advance.  .,1
Are you busy  one  week later go Lancaster   ?,0
How about  go Omaha suspend  eihgt day go buy Diet foods  ?,0
You free 9 month early  go San Jose  ?,1
don't  I'll be out of town.  see Black Panther 3 month earlier. .,1
go where  go Lincoln on Thursday  ?,2
No.  I can't.   nine  week before. go Salt Lake City  .,1
Do you want go get Diet foods  on Friday  ?,2
How about  go Zurich Cheese 7 month in advance.  ?,1
No.   I'll be out of town. Olymel go Nashville 10 day later .,0
nope  I'll be out of town. go buy Jack Daniels   nine  week advance. .,1
Where we  postpone 3 month   ?,0
Where we go Fort Lauderdale  postpone 3 month  ?,0
Are you free  go get Edelweiss  on Thursday  ?,2
What place  on Saturday go New York  ?,2
Where    eihgt year after  ?,0
Are you free  the day after tomorrow Medicines go Valetta  ?,2
You free  go Oakland the day after tomorrow  ?,2
What time should we meet 3 day after    ?,0
How about  go Portland go get Merc Clothing 1 month early  ?,1
You free   twelve  week advance. go Detroit  ?,1
Why not go Henderson  on Monday  ?,2
Let us go Albuquerque go buy Healthtex to advance  four month  ?,1
Sorry I can't.  on Wednesday  go buy Snack foods .,2
What place  go Irving on Thursday  ?,2
How about   go Fayetteville on Friday  ?,2
Are you busy    move to  ten day  ?,0
no way I dont have time go Albuquerque go buy Healthtex tomorrow .,2
OK   10 day advance. .,1
Why not go Otawa   three year prior.  ?,1
Where do you want   today  ?,2
Are you busy  go Madrid go get Absolut  ten day after  ?,0
What day should we meet on Wednesday go Valetta   ?,2
Yes  five month after go get Andy Capp's fries  .,0
What location go Los Angeles  eleven  week after go buy Strongbow  ?,0
Are you free  Prigat  postpone  three day  ?,0
Shall we tomorrow go Indianapolis   ?,2
Of course  suspend 7 month  .,0
True dat go Columbus hold up for  eleven month go buy Forever Lazy .,0
What time should we meet go Ontario  5 month early  ?,1
Good go Laredo on Wednesday  .,2
Do you want  late for  nine day   ?,0
Sure!  go get JNCO  one  week later .,0
What location go Springfield on Sunday Absolut  ?,2
Nice on Friday go buy Lee go Boston .,2
Where we meet    two  week later  ?,0
Would you go Henderson House-cleaning products  five year prior.  ?,1
what day go Hollywood hold up for 2 year go get Guaranito  ?,0
Where we go get Burger King go El Paso 2 year ahead.  ?,1
Where we meet 4 year advance. go Fullerton   ?,1
okay  to advance  eihgt day Nudie Jeans .,1
no way I dont have time  go Berna suspend  twelve year .,0
Sure.  late for  nine day go Tulsa  .,0
Where  the day after tomorrow go Detroit  ?,2
Shall we defer 10 year    ?,0
Where we meet on Friday go get Diet foods go Hollywood  ?,2
exactly go get Bread today  .,2
Sorry.  I'm busy...  go Oakland Bel Group  four year after .,0
 I'm busy...   go Memphis on Sunday .,2
Why not suspend  nine day    ?,0
Why not 2 month ahead.    ?,1
OK go get Knorr hold up for  eleven  week go Fayetteville .,0
What day should we meet move to  ten month    ?,0
OK delay for   five month go Fayetteville  .,0
Let us  DKNY the day after tomorrow  ?,2
Yeah... go Springfield Guaranito  eihgt  week early .,1
Where we meet  go Pittsburgh  five year before.  ?,1
Let us   suspend  four month  ?,0
No.  I'm busy...    late for 10  week .,0
Would you on Thursday go Bakersfield   ?,2
no way  I'll be out of town. Dry Goods go Ontario defer 1 month .,0
Where we  twelve year before. go Phoenix Mohito  ?,1
Let us tomorrow go get Baby Gap go Boston  ?,2
Let's  defer  four day go Toledo go buy Dry Goods  ?,0
Let us  Olymel on Monday  ?,2
Sounds good.    four day early  .,1
Do you want Fruits  delay for   five month  ?,0
don't  I have plans already.  go Toledo move to 3 month go buy Blue Moon .,0
Sure!  on Sunday   .,2
what day see Seven on Wednesday go Cincinnati  ?,2
Where we meet 4 day ahead.    ?,1
No. I'm busy...   hold up for 6 day go Philadelphia .,0
 I can't.    nine day in advance.  .,1
Let us go buy Healthtex  tomorrow  ?,2
When should we meet  late for 4 year go Hayward  ?,0
When should we meet to advance 2  week    ?,1
Let us hold up for 6 month  go Oakland  ?,0
You free   go buy Strongbow 1  week early  ?,1
Where  postpone  seven day   ?,0
go where to advance 10 day    ?,1
Are you free at one year after  go San Diego  ?,0
what day hold up for  six year    ?,0
Where we  four day early go New York   ?,1
Are you free at go New York  move to  twelve year  ?,0
go where  defer  eihgt year   ?,0
Of course defer 9 month  go Miami .,0
no I dont have time 4 day ahead. go Scottsdale go buy Ex-Boyfriend .,1
Where do you want go Toledo  on Tuesday  ?,2
what day go buy Grolsch on Monday   ?,2
okay    eihgt  week after .,0
nope  I have plans already.  on Saturday   .,2
When should we meet go buy Kits go Wien 2  week earlier.  ?,1
what time go Indianapolis  nine  week in advance. go get Secret Recipe  ?,1
Nah  I'm busy.   tomorrow  .,2
Would you hold up for 8 day    ?,0
Are you busy  go buy Kits go Wien today  ?,2
OK!  go Hollywood hold up for 2 year go get Guaranito .,0
What location on Monday go Saint Paul go get Budweiser  ?,2
Shall we go Bucharest  the day after tomorrow  ?,2
go where  the day after tomorrow go Colorado Springs  ?,2
what day  go buy Brahma hold up for 8 day  ?,0
No.  I'm busy...  10 month ahead. Cross Colours go Miami .,1
k today   .,2
Are you busy  go Anaheim  8 day early  ?,1
Do you want on Friday    ?,2
Of course  seven  week after   .,0
You free see Fantastic Beasts and Where To Find Them  twelve  week advance.   ?,1
Shall we go Indianapolis 9 year earlier. Kinder  ?,1
What location the day after tomorrow Applebee's   ?,2
Let us  suspend  four month go buy Cosmetics  ?,0
Where should  on Monday   ?,2
Are you free at  seven  week in advance.  go buy Bakery products  ?,1
Want to   nine day early   ?,1
No.   I'll be out of town. go New Orleans  eleven day prior. Dr. Oetker .,1
OK!  go Salem  defer one year .,0
Let us on Saturday go get Dunkin' Donuts go Quebec  ?,2
Would you hold up for  six year    ?,0
what time go buy Tanqueray go Denver  three month before.  ?,1
Why not   on Sunday  ?,2
what day see Seven postpone 9  week go Cincinnati  ?,0
Sorry I can't.    1 year later .,0
not I'm busy.  2 year earlier. go buy Avirex go Indianapolis .,1
What place Prigat 1 day in advance. go Dallas  ?,1
Want to go get SABA on Tuesday go Berlin  ?,2
What location  go Tulsa defer  six  week  ?,0
no  I have plans already.  go Springfield on Sunday go buy Pepsi .,2
