text,labels
Nah  I dont have time  go get Grolsch the day after tomorrow .,2
Let's  on Monday    ?,2
What place 4 year early see Seven   ?,1
How about   go Tulsa defer  six  week  ?,0
go where go buy Brahma go Glendale one day earlier.  ?,1
Nah   I'll be out of town. 9  week early   .,1
k  tomorrow go buy Coca Cola .,2
What day should we meet go get Absolut  to advance  two day  ?,1
What day should we meet go Wien  on Sunday  ?,2
what time   twelve year ahead. go buy Sweets  ?,1
That's right Koalapop on Tuesday go Nashville .,2
what day on Saturday go buy Strongbow go Scottsdale  ?,2
Are you free   on Monday   ?,2
Shall we go Tulsa  three year before. go get Grolsch  ?,1
What place 5  week prior.    ?,1
Where should on Monday Bel Group   ?,2
Yep go buy Brahma go Glendale one day earlier. .,1
What place   suspend 10  week  ?,0
Let us go buy Cosmetics  three  week ahead.   ?,1
exactly  on Wednesday  .,2
When  go Salt Lake City on Tuesday   ?,2
Sorry I can't.  LEonidas the day after tomorrow  .,2
no I'm busy.  Moutai go Fort Lauderdale the day after tomorrow .,2
Would you go get Six Deuce  7 day earlier.  ?,1
Where we  4  week in advance.   ?,1
Where should Bel Group 1 month advance. go Oakland  ?,1
of course Evian on Saturday go London .,2
Shall we one day prior.    ?,1
You free  go San Diego  six day early DKNY  ?,1
Where do you want  Flowers on Monday  ?,2
Sorry.  I can't.  today go Chicago go get Salmon .,2
Let us go buy Guinness  two year prior. go Minneapolis  ?,1
Let's  go get Guaranito tomorrow   ?,2
Why not suspend  three  week go buy Keystone Light go Innsbruck  ?,0
nope  I have plans already.  hold up for  six day go buy Pizza Hut go Madrid .,0
of course not I'm busy...   nine  week in advance.  go Laredo .,1
Where do you want tomorrow    ?,2
Where should go get Bewley's  three day in advance.   ?,1
Let's  go Chicago go get Salmon suspend  six  week  ?,0
go where on Friday go Garland   ?,2
Would you Poultry tomorrow   ?,2
Where do you want Flowers go Tulsa on Monday  ?,2
nope I dont have time move to  twelve year go New York Domino .,0
Are you free at on Thursday    ?,2
When should we meet  go buy Baby-care today  ?,2
Where we Dry Goods go Ontario on Saturday  ?,2
Shall we postpone 8 year go Laredo   ?,0
Do you want go buy Sun-Pat go San Jose on Wednesday  ?,2
Great.  Bel Group tomorrow  .,2
When  on Sunday see Ice Age 1 go Prague  ?,2
How about   six month before. go get Budweiser go Saint Paul  ?,1
Let us go Wien 1  week prior. Olymel  ?,1
Why not  9  week early go San Diego  ?,1
You free    on Sunday  ?,2
OK   suspend 1 year .,0
Where should go Miami 2 year later Cross Colours  ?,0
"No..., I  I have an appointment.   go get Medicines late for 7  week .",0
Nah  I can't.  M&M Food Market  three year before.  .,1
what day go Scottsdale  to advance  seven month  ?,1
When should we meet go Springfield  on Sunday  ?,2
what day  go buy Brahma  four day earlier.  ?,1
Where  2 month in advance.   ?,1
"No..., I I dont have time to advance 9 month go get Hygiene products  .",1
 I dont have time  three day in advance. go Orlando go get Bewley's .,1
exactly   1 year later .,0
OK on Sunday go Rome go get Bacardi .,2
Want to   four year after   ?,0
When should we meet go Springfield on Wednesday   ?,2
Are you free at  three day ahead.  go get Knorr  ?,1
Yes    twelve day before. .,1
What time should we meet go Springfield on Thursday   ?,2
Why not suspend  nine day go Indianapolis go buy Avirex  ?,0
Great.    on Tuesday .,2
What time should we meet today    ?,2
yeah on Monday  Brooks Brothers .,2
That's right go Fullerton on Thursday  .,2
Let us   on Sunday  ?,2
Would you on Monday go Minneapolis   ?,2
When should we meet go Berna late for 1 month go buy Angels Jeanswear  ?,0
Where we go Fullerton  on Wednesday  ?,2
You free  on Wednesday go Prague go buy Snack foods  ?,2
Let's    ten year ahead. Baby-care  ?,1
When should we meet postpone  eleven  week    ?,0
Let us move to 6 month Olymel   ?,0
  I'll be out of town. to advance  ten year go Bakersfield go get Frozen foods .,1
Why not postpone 9  week  go Cincinnati  ?,0
Let us tomorrow    ?,2
Want to go Fremont  five  week advance. go buy Ground turkey  ?,1
Why not go Philadelphia  on Wednesday  ?,2
Are you busy  Granini the day after tomorrow   ?,2
agree  five day later Baby-care  .,0
No.  I'm busy...    2 year later .,0
Let us postpone  four day    ?,0
How about  go Bellevue Juicy Juice tomorrow  ?,2
of course not I'm busy...  go buy Mohito on Wednesday  .,2
Why not go buy Mohito on Wednesday   ?,2
don't I'm busy...  to advance 5 day go get Mustard go New Orleans .,1
You free 8 month before.  go New York  ?,1
Let's  hold up for  three  week go Lisbon   ?,0
Where do you want see Black Panther  the day after tomorrow  ?,2
When  to advance  four month go buy Healthtex   ?,1
Shall we  nine  week in advance. go Laredo go buy Mohito  ?,1
Are you free  go Bridgeport  eihgt day prior.   ?,1
what time   on Monday  ?,2
When  on Sunday go Fayetteville   ?,2
When  Medicines   nine  week prior.  ?,1
Where tomorrow  go Escondido  ?,2
Nice the day after tomorrow go Innsbruck  .,2
Would you hold up for  three year go Pittsburgh   ?,0
Would you  defer  eihgt year   ?,0
Would you  move to 9 year Dr. Oetker  ?,0
Let's  go Bridgeport delay for  6 month   ?,0
Want to  go Detroit on Wednesday  ?,2
Let us today go New York   ?,2
Are you busy   on Saturday go Quebec  ?,2
Are you busy  on Thursday  Canned Goods  ?,2
You free   5 month earlier.  ?,1
Are you free at  to advance 7 year go San Antonio  ?,1
Where should   ten month advance. go Nashville  ?,1
What location 1 month early  go get Merc Clothing  ?,1
no way  I'll be out of town. go buy Juicy Juice on Tuesday  .,2
How about  go get Cosmetics 4 month earlier. go Dallas  ?,1
Are you free at go get Bread go San Diego 4 day before.  ?,1
Where do you want   1  week prior.  ?,1
You free  go buy C&A move to  nine  week go Escondido  ?,0
How about  go Henderson go get House-cleaning products postpone  seven year  ?,0
What location to advance  four year    ?,1
Where 1 year later go Glendale   ?,0
Nah  I can't.  M&M Food Market hold up for  three  week go Valetta .,0
okay tomorrow   .,2
agree 2 year in advance. go get Heinz  .,1
You free   five year before.    ?,1
Are you busy    six year ahead.   ?,1
That's right  seven day before. Baskin robbins  .,1
go where Deep River Rock  on Saturday  ?,2
Sorry.  I dont have time late for 10  week go buy Bel Group go Jersey City .,0
what day Evian on Saturday go London  ?,2
don't I dont have time   1  week early .,1
Are you free   9 month after   ?,0
Why not 7  week early go buy Lee   ?,1
Where we meet  go Salt Lake City 6 month after  ?,0
agree  two day prior.   .,1
don't I can't.  on Monday go Zurich  .,2
Where we Moutai go Fort Lauderdale the day after tomorrow  ?,2
Why not on Monday    ?,2
Why not  go Glendale on Wednesday  ?,2
Where we go get House-cleaning products on Monday   ?,2
Ok.  see Chocolat to advance  two  week  .,1
Are you busy   the day after tomorrow go Colorado Springs  ?,2
Sorry.  I'm busy...   1 month advance. Bel Group .,1
Would you move to 9 year go New Orleans Dr. Oetker  ?,0
of course not I can't.  House-cleaning products tomorrow  .,2
Sure!  on Monday  see Transformers .,2
Nice Mataano go Innsbruck the day after tomorrow .,2
what time ?,2
Where we  go get Blue Moon postpone 5 year  ?,0
Would you  go Reno  twelve  week before.  ?,1
Sounds good.    on Wednesday .,2
You free go get Heinz hold up for  six year go Chicago  ?,0
Where do you want today    ?,2
Would you   suspend one year  ?,0
Sure!  go Jersey City postpone  seven day see Transformers .,0
Great.  suspend  nine  week Mustard go Anaheim .,0
You free  go Jersey City  nine month ahead.   ?,1
Are you busy  hold up for  five day go Innsbruck Granini  ?,0
what day today go Glendale   ?,2
Nice 4 month in advance. Personal hygiene  .,1
What place   twelve year ahead. go buy Sweets  ?,1
Where do you want on Monday  go Wien  ?,2
How about   defer  four year   ?,0
Yes  the day after tomorrow go Colorado Springs .,2
what time  go Bakersfield move to 6 year  ?,0
What time should we meet on Sunday    ?,2
Would you  to advance 9 month   ?,1
What day should we meet  suspend  six  week go get Salmon  ?,0
What day should we meet ?,2
How about  go Springfield  five month after   ?,0
Where we go Fullerton  five month advance.   ?,1
can't wait   nine year before.  .,1
what day  on Wednesday see Seven  ?,2
When should we meet tomorrow    ?,2
When  ?,2
What time should we meet ?,2
Are you free at Mohito  defer  eihgt month  ?,0
Shall we   8  week in advance.  ?,1
When  see Pretty Woman 4  week in advance. go St. Louis  ?,1
Yeah... late for 1  week   .,0
 I dont have time    three year later .,0
What time should we meet go get Grolsch the day after tomorrow go Tulsa  ?,2
What place go get Medicines on Tuesday go San Antonio  ?,2
What day should we meet go Laredo on Wednesday   ?,2
Do you want  on Saturday Eggs  ?,2
alright  on Sunday  .,2
That's right   postpone  eleven day .,0
Are you busy  Ex-Boyfriend on Saturday go Moreno Valley  ?,2
no I'm busy...  go buy Brahma  on Tuesday .,2
What time should we meet 10 day earlier.  go buy Diet foods  ?,1
OK!  see Black Panther  the day after tomorrow .,2
OK hold up for 8 day   .,0
Do you want go buy Dunkin' Donuts defer 9 month   ?,0
When should we meet   the day after tomorrow  ?,2
Would you  go Oakland  eleven month before.  ?,1
don't I can't.   on Wednesday  .,2
What place go buy Loyandford on Saturday   ?,2
You free  see Blood Diamond  eleven month before.  ?,1
Do you want 9 year early go Sacramento   ?,1
Yep  on Saturday go Quebec .,2
Do you want  Hamilton Shirts postpone 4  week  ?,0
what time go get Edelweiss  on Thursday  ?,2
Sounds good.  Prigat  postpone  three day .,0
what time   seven  week early Granini  ?,1
Let us  on Saturday go Quebec  ?,2
exactly go Springfield go buy DKNY 5 month earlier. .,1
Do you want  9 year early Heinz  ?,1
Let us   five  week later   ?,0
Of course  go Ontario defer 1 month .,0
Why not  on Saturday go Fullerton  ?,2
what time  ten month advance.    ?,1
Do you want defer 10 year  Canned Goods  ?,0
Where go get McDonald's   seven day before.  ?,1
Let us on Monday go Wien Olymel  ?,2
Do you want on Sunday go Anaheim go get Andy Capp's fries  ?,2
What location Baby food go Philadelphia 2 month ahead.  ?,1
You free go Kansas City   four year early  ?,1
Are you busy  today go Chicago go get Salmon  ?,2
What location today  go buy Kits  ?,2
Let us    eihgt month after  ?,0
Yes   two  week in advance.  .,1
 I dont have time on Sunday   .,2
Why not  one day earlier. go Glendale  ?,1
Of course  go Miami 8 month in advance. .,1
What time should we meet the day after tomorrow go Fort Lauderdale   ?,2
Are you free at on Saturday go buy Strongbow   ?,2
go where 5 month early go Ontario SABA  ?,1
Let us hold up for  six day go buy Pizza Hut go Madrid  ?,0
Where do you want to advance 2 month    ?,1
Are you free   go Oakland late for  eihgt year  ?,0
k defer  nine month go buy Pepsi  .,0
Are you busy    4 day prior.  ?,1
You free on Thursday Decorations go Hollywood  ?,2
Sorry  I'll be out of town.  to advance 7 year go San Antonio .,1
Do you want go Laredo on Saturday Eggs  ?,2
What place  7 month in advance.   ?,1
Do you want defer 8 day go get Brooks Brothers   ?,0
That's right see Avengers Infinity War  on Sunday .,2
go where   move to  twelve year  ?,0
Would you  on Thursday go buy Converse  ?,2
go where on Sunday go Ontario SABA  ?,2
Want to  on Wednesday   ?,2
Where should 7 month after    ?,0
No.   I'll be out of town.    eleven day prior. .,1
Are you free at go Fort Lauderdale to advance  four day Moutai  ?,1
Where do you want  go get Nesquik 7  week in advance.  ?,1
Are you free  go buy Knorr on Monday   ?,2
You free go Saint Paul  three  week advance. go buy Toys  ?,1
reject I'm busy.   three day earlier. go Fullerton Lavazza .,1
Want to tomorrow    ?,2
Let us defer 1  week  go Fullerton  ?,0
Nah   I'll be out of town. go buy Keystone Light  on Monday .,2
Would you  ten year ahead.  Applebee's  ?,1
Want to go get Absolut  to advance  two day  ?,1
Why not defer 8 day go get Brooks Brothers   ?,0
When  1 day after  go Denver  ?,0
Yup  ten month later  Heineken .,0
go where SABA  on Sunday  ?,2
Sure.    the day after tomorrow .,2
Yes go buy Knorr on Monday  .,2
What time should we meet  seven day before.    ?,1
Of course    nine year earlier. .,1
Shall we   to advance  seven  week  ?,1
No. I can't.  Decorations  seven year early go Hollywood .,1
What place Prigat  postpone  three day  ?,0
no way  I have an appointment.   go Rome delay for   eihgt year .,0
Where we defer 10 year  Canned Goods  ?,0
No.  I'm busy.   six day prior. Evian  .,1
what day  go buy Candies on Tuesday  ?,2
Yes hold up for 6 year  go buy Knorr .,0
What time should we meet  7 day early go Rochester  ?,1
Why not go Ontario  on Wednesday  ?,2
Sorry.  I'm busy.    the day after tomorrow .,2
What day should we meet   1 year later  ?,0
Where do you want Baby-care on Sunday   ?,2
Where should defer 9 month  go Miami  ?,0
Are you free at   to advance  seven month  ?,1
When should we meet go Minneapolis   two year prior.  ?,1
What place  today Prigat  ?,2
k today  go El Paso .,2
Would you  three year before. go Valetta M&M Food Market  ?,1
Let's  tomorrow go New York   ?,2
Nah   I have plans already.  7 month in advance. go get SABA  .,1
agree to advance 2 month   .,1
"No..., I  I'll be out of town.  go buy Grolsch suspend 8 day .",0
what time go Charlotte see The Notebook one day prior.  ?,1
go where  suspend 7 month   ?,0
reject  I'll be out of town. tomorrow go get Guaranito go Hollywood .,2
Do you want  go buy Strongbow 1  week early  ?,1
Where we meet go get Secret Recipe 6 month after   ?,0
When should we meet  1  week prior. Olymel  ?,1
"No..., I  I have an appointment.  go get Medicines go Rochester 7 day early .",1
Sorry.  I'm busy.   Kits 7 day before. .,1
Yup Cosmetics 1 day after go Denver .,0
Of course go buy Healthtex  tomorrow .,2
Are you free  hold up for 6 year  go buy Knorr  ?,0
not  I have plans already.  4 year early see Seven  .,1
What time should we meet on Monday Cheese   ?,2
what day suspend  ten year Kinder   ?,0
no I'm busy...   three year early   .,1
reject I'm busy.  go Fullerton Lavazza on Thursday .,2
Where do you want go get Magnum  late for 4 year  ?,0
Want to  4  week prior. go Bridgeport  ?,1
no  I have an appointment.  tomorrow   .,2
Let's    eihgt year after see Fantastic Beasts and Where To Find Them  ?,0
You free    eihgt year earlier. go buy Domino  ?,1
Where we meet 2  week before.    ?,1
Where do you want go Scottsdale  to advance  seven month  ?,1
Let us  on Wednesday go Madrid  ?,2
When should we meet go Denver go buy Jack Daniels  nine  week advance.  ?,1
of course on Saturday  go London .,2
Where we  on Monday go Henderson  ?,2
Are you free at delay for  6 month go get Flowers   ?,0
Nice  on Saturday go New York .,2
Would you  two month advance.  go Bakersfield  ?,1
What time should we meet  late for  twelve month go get Diet foods  ?,0
Shall we   postpone 5 year  ?,0
What time should we meet on Wednesday go Prague go buy Snack foods  ?,2
Want to go Detroit 1  week early White rice  ?,1
what day  eihgt day early go buy Dry Goods   ?,1
Where we  go get Burger King 2 year ahead.  ?,1
nope I'm busy.  go get Magnum  late for 4 year .,0
What location go Phoenix tomorrow go buy Coca Cola  ?,2
Where we meet  Heinz 6 day after  ?,0
Shall we go Bakersfield go get Frozen foods on Thursday  ?,2
You free    eihgt month later go Rochester  ?,0
no I can't.  on Saturday   .,2
no  I'll be out of town. 10 month before.   .,1
OK!    defer  six  week .,0
Let's  on Monday go Zurich   ?,2
What time should we meet  Guaranito on Thursday  ?,2
what day  see Avengers Infinity War hold up for  four day  ?,0
Would you  Baby food on Wednesday  ?,2
Where Mataano go Innsbruck  eleven year earlier.  ?,1
Are you busy  go Glendale Max Studio 4 day prior.  ?,1
Why not 8 year after go get Kinder go New Orleans  ?,0
of course not I'm busy.  tomorrow  Applebee's .,2
Sorry.  I dont have time on Saturday go Jersey City  .,2
Great.   go Oklahoma City suspend  four month .,0
nope  I have an appointment.  go get Baby Gap  on Monday .,2
exactly go get Knorr go New Orleans today .,2
How about   on Friday   ?,2
Where we meet suspend  five  week go Lyon LEonidas  ?,0
When should we meet ?,2
Nice Mataano  eleven year earlier.  .,1
Shall we  to advance  eihgt day Nudie Jeans  ?,1
what time 5 day after Eggs   ?,0
What day should we meet  today   ?,2
Why not  seven day before. go get McDonald's go Omaha  ?,1
Sorry.  I dont have time  go buy Bel Group  nine month ahead. .,1
You free    eihgt  week earlier.   ?,1
Sure.  on Tuesday go Tulsa  .,2
reject  I have plans already.   two day prior. see Seven  .,1
not I dont have time  late for  eihgt year see Mr. Bean's Holiday .,0
what time Granini go Innsbruck  seven  week early  ?,1
Where we meet go buy Diet foods on Wednesday go Omaha  ?,2
Do you want Brooks Brothers go Prague 1 year earlier.  ?,1
Yeah... postpone  four  week go San Jose go buy Sun-Pat .,0
What time should we meet   1  week early  ?,1
nope I'm busy.  one  week later go Lancaster  .,0
Shall we go Huntsville  late for 10  week  ?,0
Sure.   hold up for 9 year  .,0
Sorry.  I'm busy.   suspend 1 year Kits .,0
Yep go Quebec go get Dunkin' Donuts  ten  week advance. .,1
no way  I have an appointment.  delay for   eihgt month go get McDonald's go Omaha .,0
yeah go Bridgeport delay for  6 month  .,0
Do you want  tomorrow Heinz  ?,2
Where do you want today M&M Food Market go Baltimore  ?,2
Let's  go Detroit see Fantastic Beasts and Where To Find Them  eihgt year after  ?,0
k go Sacramento Applebee's hold up for 4  week .,0
yeah  go Rochester  two month early .,1
go where hold up for  six year  go Chicago  ?,0
Where should today    ?,2
How about  on Sunday    ?,2
What time should we meet go Springfield   eihgt  week early  ?,1
Where we on Thursday  Canned Goods  ?,2
  I have an appointment.  on Wednesday  Bewley's .,2
no way  I'll be out of town. go Tulsa late for  nine day go buy Juicy Juice .,0
Do you want go get Andy Capp's fries suspend  ten  week   ?,0
yeah   ten month before.  .,1
Where should  go buy Candies on Tuesday  ?,2
Of course go buy JNCO  late for 10 day .,0
Sounds good.   today Prigat .,2
what time move to 10 day  go Indianapolis  ?,0
Yes LEonidas the day after tomorrow  .,2
What time should we meet go get Diet foods  on Friday  ?,2
When should we meet   today  ?,2
Where should Koalapop 7 month after   ?,0
What day should we meet hold up for 4  week    ?,0
What time should we meet  defer  eihgt year go buy Acorn Stores  ?,0
Where do you want   nine year before.   ?,1
Yep go buy Guinness  two year prior. go Minneapolis .,1
You free on Wednesday    ?,2
How about   tomorrow go Boston  ?,2
You free  Baby-care on Sunday go Irving  ?,2
Why not 4 year advance. go Fullerton   ?,1
You free defer  twelve  week    ?,0
what day late for 1  week    ?,0
What place  on Wednesday   ?,2
can't wait  postpone  two month go get Baby Gap .,0
Nah  I'm busy.  Poultry go Tulsa 9 month after .,0
go where go get Bel Group tomorrow   ?,2
what time on Friday go Fayetteville go get Knorr  ?,2
What day should we meet go Bakersfield  to advance  ten year  ?,1
You free on Saturday  go Nashville  ?,2
Where should 8 month in advance. go buy Dunkin' Donuts go Miami  ?,1
When should we meet tomorrow  go Phoenix  ?,2
OK on Friday go Fayetteville go get Knorr .,2
Why not  the day after tomorrow   ?,2
True dat   the day after tomorrow .,2
Where  go Oakland late for  eihgt year  ?,0
Where we   the day after tomorrow  ?,2
Do you want  ten day ahead. go Phoenix   ?,1
of course go buy Loyandford on Saturday  .,2
How about  go get Secret Recipe 6 month after   ?,0
Of course on Friday Mohito  .,2
don't I can't.  go Philadelphia Baby food suspend 8  week .,0
Of course go buy Angels Jeanswear on Monday  .,2
go where Brooks Brothers go Prague suspend  eihgt month  ?,0
What location go Henderson   five year prior.  ?,1
Where should  move to  eleven  week   ?,0
Do you want 8 day advance.    ?,1
You free  on Wednesday   ?,2
nope  I have an appointment.  move to 8 month  go get Medicines .,0
Are you free  Bewley's  4 day earlier.  ?,1
yeah   ten month before. go get Flowers .,1
Where we meet  go Rochester  two month early  ?,1
OK go get Baby Gap  hold up for  four month .,0
of course not I dont have time see Avengers Infinity War  on Sunday .,2
When should we meet 8 year after go get Kinder go New Orleans  ?,0
yeah go Wien  on Sunday .,2
Would you   eihgt  week ahead.   ?,1
no way I can't.  suspend  six day Nudie Jeans  .,0
Want to go Bridgeport  on Tuesday  ?,2
Yep  eleven day in advance.   .,1
Great.   Mustard tomorrow .,2
no  I have plans already.  go Springfield postpone  eleven  week  .,0
No.   I'll be out of town. go buy Dry Goods  defer  four day .,0
Are you busy    ten month prior. go Tulsa  ?,1
Where go Madrid   ten day after  ?,0
How about  late for 3 day go buy Taco Bell go Bridgeport  ?,0
nope I'm busy.  suspend  ten year Kinder  .,0
agree go Long Beach Canned Goods on Thursday .,2
Where we go Columbus go get Blue Moon postpone 5 year  ?,0
go where on Sunday go Fayetteville Fruits  ?,2
no way  I have an appointment.  go get McDonald's go Omaha tomorrow .,2
What location 1  week early go buy Strongbow go Los Angeles  ?,1
Would you go buy Kits go Wien today  ?,2
Want to  3 year prior. go Fayetteville  ?,1
k  ten year ahead.  Applebee's .,1
no  I have an appointment.   go buy Pepsi on Saturday .,2
No.  I dont have time  late for  twelve month  .,0
no way  I have an appointment.   today  .,2
Would you move to  four month Evian   ?,0
What place go buy Snack foods late for  eihgt year go Prague  ?,0
Where do you want hold up for  six day go buy Pizza Hut go Madrid  ?,0
nope  I have an appointment.  move to 8 month  go San Antonio .,0
go where the day after tomorrow go get Heinz go Chicago  ?,2
Are you busy  on Saturday go Quebec go buy Pepsi  ?,2
Where we meet  on Saturday Wendy's  ?,2
Would you go Colorado Springs 4 year early   ?,1
When should we meet    twelve  week advance.  ?,1
No.  I'm busy...  go Huntsville  nine day early Bud Light .,1
How about    on Wednesday  ?,2
What place on Saturday  go get Dunkin' Donuts  ?,2
not  I have an appointment.  go Bellevue  suspend 5 day .,0
Want to  7 month before. see Seven  ?,1
No.  I'm busy...  go Huntsville Bud Light tomorrow .,2
Do you want   on Wednesday  ?,2
How about  go buy Dry Goods today go Toledo  ?,2
Where  Kits 7 day before.  ?,1
Shall we go buy Ex-Boyfriend late for  eleven  week   ?,0
no  I'll be out of town.  Ex-Boyfriend  nine year before. .,1
Do you want go Lincoln  on Tuesday  ?,2
exactly on Sunday  go Houston .,2
Where should  1 month advance. Bel Group  ?,1
Let's    7 year prior.  ?,1
Yup go Berlin postpone  nine year go get SABA .,0
Do you want 8 day early go get Andy Capp's fries go Anaheim  ?,1
Sorry.   I have an appointment.  on Monday   .,2
Sure.  go Bucharest  6 day after .,0
What time should we meet go Lincoln on Tuesday go get Lee  ?,2
Let's   hold up for 2 year   ?,0
Let us move to  ten month go Portland go get Merc Clothing  ?,0
When  9  week prior.    ?,1
Why not on Wednesday go buy Mohito go Laredo  ?,2
Why not suspend  nine day go buy Avirex   ?,0
Let us go Valetta Medicines delay for   ten day  ?,0
Want to go get Kinder to advance  two day go New Orleans  ?,1
Would you Magnum go Colorado Springs the day after tomorrow  ?,2
How about  go Laredo 10 month before.   ?,1
Why not 2 month in advance. go Fremont go buy White rice  ?,1
Would you  on Thursday Heinz  ?,2
Yep  one day earlier. go Glendale .,1
Do you want postpone 9  week see Seven   ?,0
go where go Laredo on Saturday Eggs  ?,2
Want to go Washington 6 year early   ?,1
Where defer  five month    ?,0
Shall we go Stockton go buy Tommy Hilfinger the day after tomorrow  ?,2
Do you want see Black Panther the day after tomorrow go Salem  ?,2
Are you free   go Tulsa 5  week prior.  ?,1
OK!  on Wednesday   .,2
of course not  I'll be out of town.  go Oakland the day after tomorrow .,2
don't I can't.  on Monday Cheese  .,2
Want to  go Innsbruck  four year after  ?,0
How about  go Portland on Sunday   ?,2
What place  today go buy Ground turkey  ?,2
No.  I can't.   go get Secret Recipe  nine  week before. .,1
Why not   suspend  nine  week  ?,0
nope  I have plans already.   nine year in advance.  Cosmetics .,1
yeah go get Medicines on Thursday go Rochester .,2
Where 5 month before. go buy Highland Spring   ?,1
yeah 5 month early go Ontario SABA .,1
You free  go Denver on Monday  ?,2
k suspend  ten  week go Anaheim go get Andy Capp's fries .,0
Why not Baby food  2 month ahead.  ?,1
no  I have an appointment.  postpone  nine month go Pittsburgh  .,0
Where  twelve  week earlier.  go Escondido  ?,1
Nah   I'll be out of town.   on Sunday .,2
Do you want go Salem  the day after tomorrow  ?,2
Let us    eihgt  week early  ?,1
agree  see Blood Diamond  eleven month before. .,1
Yes  suspend  five  week  .,0
no I'm busy...  go Henderson see Allied  two month early .,1
Yes go get McDonald's  tomorrow .,2
can't wait  9 month after go Tulsa .,0
What place defer 10 year    ?,0
Why not Personal hygiene  defer 10 year  ?,0
Why not  defer  eihgt year go buy Acorn Stores  ?,0
Want to   move to 8 month  ?,0
Why not on Saturday go New York Personal hygiene  ?,2
You free  go buy Snack foods 9 month advance.   ?,1
No.   I'll be out of town. Dr. Oetker go New Orleans on Thursday .,2
When    ten month prior. go Tulsa  ?,1
OK   6 year early .,1
OK 7 day before.  go Charlotte .,1
Where should  go buy Candies to advance  six day  ?,1
Sorry I'm busy.  go Colorado Springs 4 year early  .,1
no way  I'll be out of town. Dry Goods go Ontario on Saturday .,2
not  I'll be out of town.   twelve year before. go Phoenix .,1
No.  I'm busy...  go Huntsville  late for 10  week .,0
Yeah... M&M Food Market go Baltimore 9  week in advance. .,1
