text,labels
What day should we meet go get Cosmetics postpone  eleven day   ?,0
Are you busy  today  go Fremont  ?,2
what time  delay for   seven month   ?,0
Where should go Fort Lauderdale  nine month later   ?,0
Would you go Philadelphia  on Wednesday  ?,2
What time should we meet   nine day ahead. go get Diet foods  ?,1
Do you want  defer 8 day   ?,0
Are you busy  1 year later  go Fremont  ?,0
When  the day after tomorrow  go Nashville  ?,2
You free  go San Antonio move to 8 month go get Medicines  ?,0
Do you want  Heineken tomorrow  ?,2
You free hold up for  three  week M&M Food Market   ?,0
Where we meet on Tuesday    ?,2
 I can't.  go Long Beach Canned Goods on Thursday .,2
Where should go buy DKNY  hold up for 4 month  ?,0
How about    8 month in advance.  ?,1
not I can't.   on Thursday  .,2
You free on Friday go get Diet foods go Hollywood  ?,2
okay  three year early  go buy Brahma .,1
Would you   nine  week advance.   ?,1
what time Domino on Saturday   ?,2
You free  go San Antonio go get Medicines  nine year earlier.  ?,1
Let us  Cosmetics 1 day after  ?,0
Sure!    on Wednesday .,2
Are you busy  on Thursday go Long Beach   ?,2
what day  on Monday   ?,2
Where do you want go buy Evolution Fresh on Monday   ?,2
what day hold up for  eihgt year go buy Eggs go Indianapolis  ?,0
can't  I have plans already.  go Saint Paul go get Cappy tomorrow .,2
what time go buy Tanqueray suspend one year   ?,0
Nah   I'll be out of town. go Ontario  5 month early .,1
Where do you want  9 month before. go Innsbruck  ?,1
True dat go Madrid go get Absolut  ten day after .,0
What time should we meet today go get Bread go San Diego  ?,2
what time go Henderson   five year prior.  ?,1
Where go buy Mohito postpone 8 year go Laredo  ?,0
You free   go Irving on Sunday  ?,2
Why not go buy Evolution Fresh on Monday go Springfield  ?,2
What time should we meet the day after tomorrow go buy Nesquik   ?,2
No.  I'm busy.  Evian on Saturday go London .,2
No.  I dont have time go Prague on Wednesday  .,2
Want to go get JNCO  one  week later  ?,0
Shall we   defer  three month  ?,0
no  I have plans already.    tomorrow .,2
go where on Saturday    ?,2
what day hold up for 2 year go get Guaranito   ?,0
Are you free    9 month later  ?,0
what day delay for  1 month  go Bridgeport  ?,0
Nah   I have an appointment.   go Irving on Sunday .,2
of course not I'm busy...  postpone 8 year go Laredo  .,0
Why not  Baby-care tomorrow  ?,2
Sure.  go San Jose  hold up for 9 year .,0
Where we suspend  twelve year go buy Bakery products   ?,0
what day move to 3 month  go Toledo  ?,0
How about   five month after go Springfield go get Andy Capp's fries  ?,0
No.  I'm busy.  Medicines   nine  week prior. .,1
"No..., I I can't.   six day early DKNY  .",1
Where should   hold up for 10 year  ?,0
Where we tomorrow go buy Bakery products go Berna  ?,2
what day   today  ?,2
okay   twelve year ahead. go Oakland .,1
Are you free at the day after tomorrow    ?,2
Where we go Henderson  postpone  seven year  ?,0
What day should we meet  delay for  7 year go get Nesquik  ?,0
Want to go buy C&A  move to  nine  week  ?,0
Let's  go Washington on Sunday   ?,2
Let's  go buy Baby-care 1 month earlier. go Santa Ana  ?,1
How about  today    ?,2
No.  I'm busy.   nine  week prior.  go Valetta .,1
How about  delay for   eihgt year go get Bacardi   ?,0
no way I'm busy.  suspend  nine  week  Mustard .,0
What place 4 month in advance. Personal hygiene   ?,1
Are you busy  the day after tomorrow LEonidas go Lyon  ?,2
Why not Cobblestone  six year prior. go San Jose  ?,1
No.  I'll be out of town.   eihgt  week earlier.  .,1
When  on Tuesday go get Secret Recipe   ?,2
When should we meet go Phoenix tomorrow go buy Coca Cola  ?,2
Do you want on Thursday go Long Beach   ?,2
OK on Friday go Hollywood  .,2
How about  10 day earlier.  go buy Diet foods  ?,1
what day  eihgt day early    ?,1
When should we meet  see Blood Diamond  eleven month before.  ?,1
What location 6 year early see Iron Man    ?,1
not  I have an appointment.  go Washington   eihgt year earlier. .,1
Are you busy   late for  nine day   ?,0
Sounds good.  go buy Candies  nine month later go Fort Lauderdale .,0
Where we on Monday    ?,2
When  Deep River Rock  on Saturday  ?,2
No.  I'm busy...  go Irving 9  week prior.  .,1
You free   ten year before. go buy C&A go Escondido  ?,1
agree  go get Heinz the day after tomorrow .,2
Are you free at  Dry Goods defer 1 month  ?,0
Do you want 2 month in advance. go buy White rice   ?,1
Yes  hold up for 6 year  .,0
You free  go Jersey City go buy Bel Group on Saturday  ?,2
Would you delay for   eihgt year go get Bacardi   ?,0
You free  on Saturday go Huntsville   ?,2
What place on Wednesday    ?,2
Would you  go Philadelphia 2 month ahead.  ?,1
What place   4 month in advance.  ?,1
Sure!  Max Studio  move to 10 month .,0
what day go get Kits  on Thursday  ?,2
don't I'm busy...  go buy Dr. Oetker 3 year advance.  .,1
No. I'm busy...    ten year ahead. Baby-care .,1
Good  go Oakland defer  six  week .,0
nope I'm busy...    six month before.  .,1
What place   move to 8 month  ?,0
Shall we late for 10  week Bud Light go Huntsville  ?,0
What time should we meet go Lincoln  on Tuesday  ?,2
When  go San Antonio move to 8 month go get Medicines  ?,0
don't  I'll be out of town. Frozen foods  seven month before. go Philadelphia .,1
what day today  go Toledo  ?,2
Where we   ten year ahead.   ?,1
don't I can't.  Baby food go Philadelphia on Wednesday .,2
Shall we   today  ?,2
True dat  move to  nine day go get Knorr .,0
How about  go Laredo on Saturday Eggs  ?,2
Why not go Oakland   eihgt  week after  ?,0
You free  on Saturday    ?,2
okay go Stockton  the day after tomorrow .,2
Let us hold up for 2  week  go buy Toys  ?,0
what time Ecko Unlimited go Rochester on Wednesday  ?,2
What day should we meet  go buy Wendy's 6 day advance.  ?,1
 I dont have time 7 month before.   .,1
What place the day after tomorrow    ?,2
Yes go Fayetteville on Monday go buy Knorr .,2
What time should we meet today  go El Paso  ?,2
Sorry.  I'm busy.   suspend  four month go buy Cosmetics .,0
not  I'll be out of town. on Monday go Minneapolis  .,2
what day go Baltimore on Sunday see Avengers Infinity War  ?,2
Why not  go get Frozen foods  nine year later  ?,0
exactly one year after   .,0
Are you free at  three day in advance.  go Orlando  ?,1
No.  I'm busy.  the day after tomorrow  go Valetta .,2
Shall we 6 day after go Bucharest go get Fish  ?,0
Where do you want    six month early  ?,1
Where should Koalapop on Tuesday   ?,2
Want to Flowers   ten month prior.  ?,1
No.  I'm busy...   Cross Colours on Wednesday .,2
When   to advance 7 year go San Antonio  ?,1
 I dont have time go Orlando hold up for 10 year  .,0
Want to  1 month advance. Bel Group  ?,1
Shall we Frozen foods defer  twelve  week go Philadelphia  ?,0
Yeah... 4 year advance. go Fullerton  .,1
Yes go buy Kits move to  ten day go Wien .,0
Where we see Pretty Woman suspend  two year   ?,0
How about  hold up for  five month go Zurich   ?,0
What place  on Wednesday go Cincinnati  ?,2
Nah   I'll be out of town. see Chocolat to advance  two  week  .,1
Are you busy     eihgt month after  ?,0
You free  nine  week in advance.  go get Secret Recipe  ?,1
okay go Stockton  five  week advance. go buy Tommy Hilfinger .,1
Are you free at  go get Papadopoulos suspend 6 month  ?,0
Of course to advance  four month go buy Healthtex  .,1
Great.  to advance 2 month   .,1
What place 9 year earlier. go Indianapolis   ?,1
Where we  DKNY the day after tomorrow  ?,2
What day should we meet go Portland on Sunday   ?,2
Would you defer  six day see Blood Diamond   ?,0
Where   9 year early  ?,1
Let us to advance 2  week go Phoenix   ?,1
Why not on Tuesday go buy Guinness go Minneapolis  ?,2
Where we late for  nine day go buy Juicy Juice   ?,0
When should we meet   nine  week advance.   ?,1
OK   nine day ahead. go get Diet foods .,1
Why not go Springfield go buy Evolution Fresh  eleven day in advance.  ?,1
When should we meet go buy Pizza Hut  to advance  three year  ?,1
Why not  nine  week in advance. go Laredo go buy Mohito  ?,1
no way  I'll be out of town.  late for  nine day  .,0
Yes go Minneapolis late for 3 year  .,0
no I'm busy...  go get Dry Goods   eihgt  week ahead. .,1
Yeah... today   .,2
Sorry.  I'm busy.  go Oklahoma City  on Tuesday .,2
Yup go Tallahassee postpone 4  week  .,0
Why not  go get Frozen foods on Thursday  ?,2
Do you want go Salem  defer one year  ?,0
What day should we meet   three year early go Escondido  ?,1
no  I'll be out of town. go Moreno Valley delay for  7 day  .,0
You free   late for 10  week go buy Bel Group  ?,0
True dat today  go Toledo .,2
What day should we meet on Saturday go Quebec   ?,2
 I dont have time  7 month before. see Seven .,1
Want to  M&M Food Market 9  week in advance.  ?,1
Want to  go Oakland on Monday  ?,2
When  10 day later  Olymel  ?,0
What location  hold up for  eihgt year go buy Eggs  ?,0
No.   I have plans already.   five  week advance. go buy Tommy Hilfinger  .,1
What time should we meet suspend 8 day go San Diego DKNY  ?,0
When  Olymel go Nashville 10 day later  ?,0
exactly   on Wednesday .,2
Great.  go Bellevue Juicy Juice tomorrow .,2
Want to go Toledo   three  week ahead.  ?,1
Where should go get Knorr go New Orleans today  ?,2
Shall we Personal hygiene  defer 10 year  ?,0
Are you free  go get Kits  delay for  1 month  ?,0
Want to  go Bridgeport on Thursday  ?,2
Sure!   9 year after  .,0
Why not   ten year ahead. Baby-care  ?,1
k go Sacramento tomorrow  .,2
yeah  delay for  7 year go get Nesquik .,0
of course on Saturday go Huntsville  .,2
Do you want Brooks Brothers on Monday go Prague  ?,2
When should we meet   four  week earlier. go Bucharest  ?,1
Sure!  go Garland go buy Tic Tac defer  three month .,0
What place the day after tomorrow  go Valetta  ?,2
When  delay for   eihgt month go get McDonald's go Omaha  ?,0
You free see Seven   three year later  ?,0
Sounds good.   on Monday  .,2
Let's   one day earlier.   ?,1
Why not suspend  six day Nudie Jeans go Ontario  ?,0
What location hold up for  eihgt year go buy Eggs go Indianapolis  ?,0
OK  7 month in advance. go Zurich .,1
What place on Saturday go Huntsville go buy Loyandford  ?,2
what day today    ?,2
You free  eleven month earlier.  go buy Starbucks  ?,1
agree go Irving   six month early .,1
Where   delay for  2 month  ?,0
What place on Monday go buy Angels Jeanswear go Berna  ?,2
Where do you want   on Tuesday  ?,2
When should we meet go buy Bel Group late for 7 month go Berna  ?,0
no  I have plans already.    7 year prior. .,1
no way  I have an appointment.  4 day after go New York go buy LEonidas .,0
What place move to 3 month  go Toledo  ?,0
No. I'm busy...   on Wednesday  .,2
Are you busy   the day after tomorrow   ?,2
Are you free at go get Knorr late for 8 year go New Orleans  ?,0
Where  Cobblestone  six year prior.  ?,1
Nah   I have an appointment.  on Monday  Brooks Brothers .,2
OK go Fayetteville 4 year before.  .,1
Would you go Minneapolis on Monday go buy Wendy's  ?,2
what time   to advance 1  week  ?,1
Sorry.   I'll be out of town.  ten month before. go Bridgeport go get Flowers .,1
When    move to 8 month  ?,0
Why not to advance 1  week go Long Beach Eggs  ?,1
Are you busy  go Quebec go get Dunkin' Donuts  ten  week advance.  ?,1
Where we meet go Hollywood late for  twelve month go get Diet foods  ?,0
Let's    hold up for 8 day  ?,0
nope  I'll be out of town.  postpone one  week  .,0
Sure!  10 month ahead.   .,1
of course not I can't.  go Henderson  move to 8 month .,0
Let's   hold up for  five day   ?,0
Want to go get Magnum go Hayward today  ?,2
You free go Springfield  delay for   four month  ?,0
OK!  the day after tomorrow  go Tulsa .,2
Yeah...   defer 5 day .,0
Sorry I can't.  go Lyon  twelve day before.  .,1
Yeah...  on Monday see Allied .,2
What place  9 month early   ?,1
not  I'll be out of town.   twelve year before. Mohito .,1
Do you want  to advance 7 year   ?,1
What time should we meet Moutai  postpone 3 month  ?,0
Are you busy   7 year later   ?,0
can't wait go Los Angeles  on Monday .,2
go where go Fullerton Lavazza on Thursday  ?,2
Where should go get Candies 5 day advance.   ?,1
When should we meet go buy Guinness  two year prior. go Minneapolis  ?,1
Sure.  defer  eihgt year go buy Acorn Stores go Irving .,0
Are you busy  Flowers   ten month prior.  ?,1
Shall we go Salt Lake City on Tuesday go get Secret Recipe  ?,2
When should we meet  go buy Ex-Boyfriend today  ?,2
Would you go get Bel Group tomorrow   ?,2
Shall we go buy Tommy Hilfinger go Stockton  two  week later  ?,0
Would you suspend 8  week  go Philadelphia  ?,0
Where do you want go Wien go get Nesquik on Sunday  ?,2
Where  on Monday   ?,2
What location   five  week later   ?,0
can't  I have an appointment.   go buy Jack Daniels on Friday .,2
nope  I'll be out of town.   nine  week advance.  .,1
True dat   to advance 5 day .,1
Sorry  I'll be out of town. delay for  9 year   .,0
not  I'll be out of town.  delay for  3 month  .,0
Shall we 7  week in advance.    ?,1
Where we meet go Salt Lake City go get Secret Recipe 6 month after  ?,0
Nah   I'll be out of town.   on Monday .,2
of course not I can't.  move to 10 day  go Indianapolis .,0
Where  go Minneapolis defer  five month  ?,0
True dat   10  week before. .,1
How about  go buy Dunkin' Donuts  8 month in advance.  ?,1
what day  ten year before. go buy C&A   ?,1
Yeah...   nine day early  .,1
nope I'm busy...   eleven year earlier. go Innsbruck  .,1
Why not go Scottsdale  the day after tomorrow  ?,2
You free   suspend  four month go buy Cosmetics  ?,0
What time should we meet  eihgt  week early  Guaranito  ?,1
Want to  six year ahead. go get JNCO go Lancaster  ?,1
Where we  go buy Jack Daniels on Friday  ?,2
Why not  Cross Colours 10 month ahead.  ?,1
Shall we suspend  ten year Kinder   ?,0
Of course go Berna on Monday  .,2
Of course  five day in advance.  go buy JNCO .,1
go where go get Bel Group   four  week prior.  ?,1
Where we meet go Hollywood   nine day ahead.  ?,1
Are you free at  go New Orleans late for 8 year  ?,0
OK 5 month before. go buy Highland Spring  .,1
Where we meet  Ecko Unlimited on Wednesday  ?,2
Why not go Long Beach to advance 1  week   ?,1
no  I have an appointment.  10  week before.  Heinz .,1
not  I have an appointment.  go Bellevue Juicy Juice 2 year before. .,1
Want to  seven  week after    ?,0
What time should we meet  hold up for 10 year go get Bewley's  ?,0
What place  Poultry 9 month after  ?,0
What day should we meet go Philadelphia Baby-care  ten year ahead.  ?,1
Why not  on Thursday go Bakersfield  ?,2
That's right  ten month advance.   .,1
can't wait  Ex-Boyfriend  nine year before. .,1
what day  9 month after go Tulsa  ?,0
When should we meet move to 1 month  go Murfreesboro  ?,0
yeah Ecko Unlimited go Rochester on Wednesday .,2
When should we meet go Henderson  postpone  seven year  ?,0
What time should we meet go Rochester late for 7  week go get Medicines  ?,0
Let's  go Glendale go buy Snack foods on Wednesday  ?,2
Are you free at go New Orleans  today  ?,2
go where 2 year in advance.    ?,1
What place see Seven on Wednesday go Cincinnati  ?,2
of course not I'm busy.  go buy Tic Tac  8  week in advance. .,1
What time should we meet the day after tomorrow go get Brooks Brothers   ?,2
What location  five year prior.    ?,1
don't I'm busy.  on Sunday   .,2
What location go Portland  1 month early  ?,1
exactly Flowers postpone  eihgt  week go Tulsa .,0
When should we meet  late for 7 month go Berna  ?,0
Do you want  on Saturday   ?,2
Why not on Wednesday go buy Acorn Stores   ?,2
Are you busy  Max Studio  move to 10 month  ?,0
reject  I'll be out of town. hold up for 2 year go Hollywood  .,0
No.   I have plans already.   4  week prior. go Bridgeport .,1
Where should Cross Colours  2 year later  ?,0
What place Poultry go Tulsa 9 month after  ?,0
of course not I can't.  go Indianapolis  nine  week in advance. go get Secret Recipe .,1
not  I have an appointment.  Max Studio  4 day prior. .,1
How about  on Monday    ?,2
What day should we meet tomorrow go Phoenix Heineken  ?,2
Want to 3 year advance.    ?,1
Why not delay for  2 month go Sacramento   ?,0
You free  see Transformers postpone  seven day  ?,0
What day should we meet go Madrid   ten day after  ?,0
Where tomorrow go get Papadopoulos   ?,2
Why not   hold up for  three year  ?,0
How about  on Tuesday  go get SABA  ?,2
reject I'm busy.  go Fullerton   three day earlier. .,1
Where do you want go Madrid  hold up for  six day  ?,0
of course not I can't.  on Saturday Hamilton Shirts go Tallahassee .,2
no  I have an appointment.  on Thursday   .,2
Sorry I dont have time postpone  four  week go San Jose  .,0
Let's   go Bridgeport on Thursday  ?,2
Are you free at 4 day before.    ?,1
what time hold up for  eleven  week    ?,0
what day go get Kits on Thursday go Bridgeport  ?,2
can't  I have an appointment.  today   .,2
Let us   late for 1 month  ?,0
Let us go Springfield Guaranito  eihgt  week early  ?,1
Shall we  go Bakersfield  nine year later  ?,0
Where we meet  on Tuesday go buy Taco Bell  ?,2
Let's   on Monday   ?,2
go where go get Six Deuce  7 day earlier.  ?,1
Are you free    1  week prior.  ?,1
Why not  9 year after   ?,0
What place go Quebec go get Dunkin' Donuts  ten  week advance.  ?,1
You free    two month early   ?,1
When    seven day before.   ?,1
 I dont have time see Seven go Worcester 7 month before. .,1
How about  go Houston go buy Evian on Monday  ?,2
When should we meet  go Stockton the day after tomorrow  ?,2
You free  go get Mustard to advance 5 day  ?,1
what time  hold up for  five day   ?,0
When should we meet go Los Angeles  on Monday  ?,2
k delay for  2 month  Heinz .,0
Where we go get Bread today   ?,2
Yup late for 3 day go Bridgeport  .,0
That's right go Lincoln on Tuesday go get Lee .,2
What day should we meet go get Bacardi one year before. go Rome  ?,1
don't  I have an appointment.  4 day before.   .,1
Want to to advance  two day go Madrid go get Absolut  ?,1
When should we meet see Blood Diamond the day after tomorrow   ?,2
Want to  go buy Dr. Oetker  four year after  ?,0
Want to suspend 6 month go get Papadopoulos go Escondido  ?,0
Where should  go Memphis on Sunday  ?,2
can't I dont have time  five month after go Springfield go get Andy Capp's fries .,0
what day today go Indianapolis   ?,2
no  I have an appointment.    eihgt year early  .,1
Ok.   Eggs on Saturday .,2
k go get Pasta go Santa Ana delay for   three year .,0
Nah  I dont have time delay for  1 month   .,0
"No..., I  I'll be out of town.   defer 5 day .",0
no way  I have an appointment.  tomorrow go Omaha  .,2
Nah   I'll be out of town.  go Innsbruck suspend  three  week .,0
What time should we meet go Scottsdale  the day after tomorrow  ?,2
Let us Converse  ten year prior.   ?,1
Are you busy  4 year early Magnum   ?,1
What time should we meet go Zurich Cheese 7 month in advance.  ?,1
k go get Burger King go El Paso 2 year ahead. .,1
When  on Monday    ?,2
Nah   I'll be out of town. go Columbus  on Monday .,2
Would you  go Oakland the day after tomorrow  ?,2
Where we  tomorrow go buy Bakery products  ?,2
How about  7 month advance.    ?,1
Yup   on Monday .,2
agree  on Tuesday  .,2
Nice  go get Edelweiss move to 6 year .,0
Where we go buy Jack Daniels go Reno defer  four year  ?,0
Want to go buy Lee  on Friday  ?,2
Where we meet    nine year later  ?,0
Where should   on Sunday  ?,2
You free  7 year advance. go Stockton   ?,1
Where should defer 8 day  go Scottsdale  ?,0
Shall we  two month earlier. go New York Domino  ?,1
No.  I dont have time go buy Snack foods 9 month advance. go Prague .,1
Where we  defer  eihgt month   ?,0
No.   I have an appointment.  late for 3  week go Berlin  .,0
When should we meet  Nudie Jeans on Wednesday  ?,2
Are you free at Baskin robbins suspend  five month   ?,0
no way  I'll be out of town. to advance  four year  go Oakland .,1
Great.  delay for  1 month go Bridgeport go get Kits .,0
agree go get Meat  on Thursday .,2
exactly  suspend  eihgt day go buy Diet foods .,0
OK  go buy Brahma  four day earlier. .,1
Do you want go Tulsa late for  nine day go buy Juicy Juice  ?,0
what day go Washington  9 year after  ?,0
How about  5 day after go Laredo Eggs  ?,0
Would you go Saint Paul   six month before.  ?,1
Why not on Wednesday    ?,2
What place go Valetta Medicines delay for   ten day  ?,0
What time should we meet Mohito go Phoenix on Friday  ?,2
What day should we meet go Saint Paul  on Monday  ?,2
Nah   I'll be out of town. the day after tomorrow  go get Kits .,2
Sounds good.  Prigat go Dallas postpone  three day .,0
go where   nine day early   ?,1
Where we meet 6 month after    ?,0
What place go get JNCO  one  week later  ?,0
Where we suspend 8 day go San Diego DKNY  ?,0
Would you Baby food  2 month ahead.  ?,1
Where do you want on Wednesday go Indianapolis   ?,2
yeah  go Rochester on Thursday .,2
You free   go buy Strongbow on Saturday  ?,2
Do you want go St. Louis see Pretty Woman suspend  two year  ?,0
Where on Tuesday go buy Guinness go Minneapolis  ?,2
True dat 7 year advance. go Stockton  .,1
No.  I can't.  go Salt Lake City on Tuesday  .,2
Sorry I'm busy.    the day after tomorrow .,2
You free  on Monday    ?,2
Let's   Baby-care tomorrow  ?,2
Let's     seven month advance.  ?,1
Why not   two day ahead. go Santa Ana  ?,1
don't  I'll be out of town. on Saturday Frozen foods  .,2
no way I dont have time  suspend  twelve year  .,0
Are you free    1  week early  ?,1
Would you M&M Food Market hold up for  three  week go Valetta  ?,0
Sure.   6 day after  .,0
What time should we meet go Los Angeles  eleven  week after go buy Strongbow  ?,0
No.   I'll be out of town. move to 9 year go New Orleans  .,0
can't  I have plans already.  go Saint Paul go get Cappy 2  week before. .,1
You free    twelve  week advance.  ?,1
Sounds good.  suspend 8 day  go San Diego .,0
What day should we meet go Minneapolis on Monday go buy Wendy's  ?,2
Where we go Tulsa to advance 7  week go buy Juicy Juice  ?,1
Want to  ten year before. go buy C&A go Escondido  ?,1
Let us 9 day in advance. go Berlin House-cleaning products  ?,1
alright  on Wednesday see Seven .,2
What place on Tuesday go get Knorr   ?,2
Where do you want go Springfield on Thursday   ?,2
What day should we meet on Monday go Saint Paul go get Budweiser  ?,2
what time   three month before. go buy Tanqueray  ?,1
no  I'll be out of town. on Saturday  Ex-Boyfriend .,2
No.   I have an appointment.   go Berlin 9 day in advance. .,1
Are you free at the day after tomorrow Moutai   ?,2
Sorry.  I'm busy.  suspend 1 year go Charlotte  .,0
No.  I'm busy.  go Bakersfield go get Edelweiss on Thursday .,2
Where should  hold up for  eleven month go Columbus  ?,0
Are you free at go buy Bakery products go Berna  seven  week in advance.  ?,1
Shall we  two day ahead.    ?,1
What day should we meet go Memphis  hold up for  ten  week  ?,0
Where we go get Burger King today   ?,2
no way  I'll be out of town. late for  nine day go Tulsa  .,0
of course not  I'll be out of town. the day after tomorrow   .,2
exactly  Flowers on Monday .,2
No. I dont have time on Saturday go Lisbon  .,2
OK go buy Brahma go Glendale today .,2
  I'll be out of town.  go buy Brahma today .,2
When should we meet late for  nine day go Tulsa   ?,0
What place 9  week prior.    ?,1
Shall we   on Tuesday  ?,2
How about  go get House-cleaning products on Monday go Henderson  ?,2
When should we meet on Thursday    ?,2
Sounds good.   four day early go New York  .,1
Where we on Thursday go Long Beach   ?,2
Shall we go buy Starbucks on Sunday   ?,2
exactly today   .,2
Yep go buy Evolution Fresh on Monday  .,2
What location tomorrow go get Guaranito go Hollywood  ?,2
When     seven year early  ?,1
Why not go buy Evolution Fresh on Monday   ?,2
not I can't.  to advance 10 day   .,1
Sure.  on Monday go Innsbruck go buy Keystone Light .,2
Are you free at on Monday    ?,2
Would you move to 6 year go Bakersfield go get Edelweiss  ?,0
Why not postpone 9  week see Seven   ?,0
What time should we meet Mohito  defer  eihgt month  ?,0
nope I'm busy.   late for 4 year go Hayward .,0
Do you want  1  week advance.   ?,1
What day should we meet Converse  ten year prior.   ?,1
what time  five day in advance. go Nashville   ?,1
Do you want see Chocolat to advance  two  week go Fayetteville  ?,1
can't I can't.  on Tuesday go El Paso  .,2
What time should we meet  to advance 4 year   ?,1
Where should go buy Candies  nine month later go Fort Lauderdale  ?,0
Want to see Seven   three year later  ?,0
Want to go buy Highland Spring  on Monday  ?,2
Are you busy  8 day early go get Andy Capp's fries go Anaheim  ?,1
nope I dont have time  two month earlier.  go New York .,1
Would you go Henderson tomorrow   ?,2
When should we meet on Wednesday go Ontario Nudie Jeans  ?,2
Of course   tomorrow .,2
Good go Henderson  move to 8 month .,0
Yes on Sunday  go Springfield .,2
What location on Saturday    ?,2
of course not I can't.  on Wednesday   .,2
Would you go Omaha suspend  five month   ?,0
What day should we meet postpone 4  week    ?,0
Would you go Toledo   eihgt  week ahead.  ?,1
Are you free at  go Berna suspend  twelve year  ?,0
What place move to 10 month go Glendale Max Studio  ?,0
Where we meet  go get Frozen foods  nine year later  ?,0
can't wait   twelve year ahead.  .,1
You free  tomorrow go buy Coca Cola  ?,2
What place  see Avengers Infinity War 5  week in advance.  ?,1
No.   I have an appointment.   9 year after  .,0
What day should we meet the day after tomorrow go get Heinz go Chicago  ?,2
When  the day after tomorrow go Lyon   ?,2
Let's   go Wien hold up for 8 day  ?,0
Shall we go buy Evolution Fresh delay for  3 month go Springfield  ?,0
go where go Laredo 10 month before.   ?,1
How about   today   ?,2
Where we today  go Toledo  ?,2
Do you want  go Scottsdale 7  week later  ?,0
Where should go Springfield on Wednesday go buy DKNY  ?,2
Are you free at Evian  on Saturday  ?,2
Yeah...  on Thursday go Bakersfield .,2
How about  defer 1  week    ?,0
