text,labels
True dat go Los Angeles on Saturday  .,2
alright on Saturday  go New York .,2
No. I dont have time go Lisbon one year early  .,1
How about   on Thursday Heinz  ?,2
Where go buy Snack foods   two  week advance.  ?,1
not I'm busy.  2 year earlier.  go buy Avirex .,1
What day should we meet go Oakland   ten year prior.  ?,1
Want to defer  nine month    ?,0
What place go Toledo on Wednesday go buy Blue Moon  ?,2
You free  go buy Snack foods   two  week advance.  ?,1
You free  delay for  one  week go buy Loyandford go Huntsville  ?,0
When should we meet go get Six Deuce hold up for  three year   ?,0
Great.  postpone  nine month   .,0
Want to go Fort Lauderdale  nine month later   ?,0
What time should we meet  postpone 3 month   ?,0
not  I have an appointment.   tomorrow  .,2
What place    eleven day prior.  ?,1
Where we go buy Brahma go Escondido  eleven month later  ?,0
Would you go Sacramento  ten year ahead. Applebee's  ?,1
What time should we meet go Omaha suspend  eihgt day go buy Diet foods  ?,0
nope  I have plans already.  go buy Pizza Hut go Madrid on Wednesday .,2
Are you free  go Innsbruck  on Tuesday  ?,2
Yup  ten day early go Tallahassee Hamilton Shirts .,1
exactly   10 day earlier. .,1
Where we    seven month before.  ?,1
no I'm busy...   go Escondido on Tuesday .,2
can't  I have an appointment.  1 month earlier.  go buy Baby-care .,1
 I dont have time see Seven   three year later .,0
When  go get McDonald's go Omaha tomorrow  ?,2
Want to  1 month advance. go Oakland  ?,1
okay go Oakland Bel Group  four year after .,0
Do you want  five day later Baby-care go Irving  ?,0
Yeah... go Fullerton Wendy's on Saturday .,2
What day should we meet suspend  nine day go Indianapolis go buy Avirex  ?,0
Where we meet late for 3 day go Bridgeport   ?,0
can't wait go buy Eggs  1  week advance. .,1
 I'm busy...   hold up for  ten  week  .,0
What location on Thursday go Oakland go buy Converse  ?,2
When    on Tuesday  ?,2
Yeah...  on Saturday go Fullerton .,2
can't I dont have time  see Pretty Woman on Wednesday .,2
Yup go get Dry Goods go Toledo on Tuesday .,2
Where we meet go Lyon  twelve day before.   ?,1
Shall we  go New Orleans late for 8 year  ?,0
no way  I'll be out of town.  5 day prior.  .,1
Where  7 day before.   ?,1
Yup go El Paso on Tuesday go get Bel Group .,2
Where should on Sunday    ?,2
Shall we on Thursday see The Notebook   ?,2
What time should we meet go Santa Ana  two day ahead. go get Pasta  ?,1
What time should we meet   seven day before. go Omaha  ?,1
Where we  go El Paso suspend 6  week  ?,0
Sure.  to advance 7 year go San Antonio Johnnie Walker .,1
Let's  go Glendale 4 day prior.   ?,1
Are you busy  go Fremont   five  week advance.  ?,1
Nah  I'm busy.   8 month earlier. go buy Forever Lazy .,1
Sorry.  I'm busy.   8 month earlier. go Scottsdale .,1
agree 7  week later go buy Strongbow go Scottsdale .,0
No.   I have plans already.   on Tuesday go buy Taco Bell .,2
exactly 10 day earlier. go Omaha go buy Diet foods .,1
Where we meet go Bakersfield go get Frozen foods on Thursday  ?,2
nope I dont have time  two month earlier. go New York Domino .,1
You free Absolut 10 day after go Springfield  ?,0
Let's   on Monday go Houston  ?,2
what day move to  four month  go London  ?,0
Nah   I have an appointment.   five day later Baby-care  .,0
Sounds good.  on Wednesday   .,2
Where do you want go buy Cosmetics  three  week ahead.   ?,1
Where we  seven  week after go Phoenix Mohito  ?,0
True dat  postpone one  week  .,0
okay on Wednesday   .,2
don't I can't.   one day later go Long Beach .,0
What time should we meet  ten  week before.  go Irving  ?,1
no way I can't.   to advance  eihgt day go Ontario .,1
Where we suspend  twelve year go buy Bakery products go Berna  ?,0
Shall we go Rochester  late for 7  week  ?,0
Let us go get Baby Gap  hold up for  four month  ?,0
of course not I can't.  move to 8 month  House-cleaning products .,0
Let's  one year after  go San Diego  ?,0
True dat go New Orleans on Tuesday go get Mustard .,2
go where go Fayetteville go get Knorr 10 day advance.  ?,1
Want to    four year after  ?,0
Sorry.  I'm busy.  the day after tomorrow go get Brooks Brothers  .,2
Where  3 year prior. go Fayetteville  ?,1
Where we meet   on Monday  ?,2
Want to go Innsbruck go buy Dr. Oetker 3 year advance.  ?,1
Let's  late for  four year  Guaranito  ?,0
"No..., I I'm busy.   delay for   three year  .",0
You free   7 year advance.   ?,1
Want to delay for  1 month  go Bridgeport  ?,0
No. I can't.  late for  six year Decorations  .,0
When   six year ahead. go get JNCO go Lancaster  ?,1
"No..., I I dont have time   7  week early .",1
Shall we   twelve year ahead. go buy Sweets  ?,1
what time on Saturday Personal hygiene   ?,2
Let's  the day after tomorrow see Fantastic Beasts and Where To Find Them go Detroit  ?,2
"No..., I I can't.   see Iron Man  on Monday .",2
OK on Sunday go Fayetteville Fruits .,2
not  I have an appointment.    2 year before. .,1
Ok.   tomorrow  .,2
Sorry.  I'm busy...  on Sunday go Anaheim go get Andy Capp's fries .,2
When should we meet 9 month early  go San Jose  ?,1
Where we   eleven month later go buy Brahma  ?,0
go where  on Thursday   ?,2
Are you free   go Bakersfield move to 6 year  ?,0
Where we on Thursday see The Notebook   ?,2
When should we meet  five  week later go Phoenix go buy Coca Cola  ?,0
no  I have an appointment.   go Amarillo on Thursday .,2
Where do you want  9  week in advance. go Baltimore  ?,1
When  go Miami on Friday   ?,2
no  I have plans already.    on Sunday .,2
Are you busy  go Murfreesboro move to  nine day go get Knorr  ?,0
Are you free at go buy Converse defer  six  week   ?,0
Sorry.  I'm busy...  Bel Group go Oakland on Monday .,2
Shall we   three year early go Escondido  ?,1
Shall we go Saint Paul tomorrow   ?,2
can't I dont have time go Springfield  two  week in advance.  .,1
Sounds good.    to advance  three year .,1
Yep go Glendale  postpone  four month .,0
go where  the day after tomorrow Johnnie Walker  ?,2
When should we meet  late for 3  week   ?,0
When    postpone  eihgt  week  ?,0
Where go Innsbruck go buy Dr. Oetker  four year after  ?,0
You free  suspend 8 day    ?,0
Where we meet go Hollywood go get Diet foods  nine day ahead.  ?,1
Let's   seven  week early  go Innsbruck  ?,1
"No..., I I'm busy.  go Madrid go get Absolut  ten day after .",0
Let us  1  week prior. Olymel  ?,1
How about  go get Andy Capp's fries go Springfield on Sunday  ?,2
can't wait Guaranito tomorrow  .,2
When should we meet go Wien move to  ten day   ?,0
You free  1  week early go buy Strongbow go Los Angeles  ?,1
When should we meet tomorrow  go New Orleans  ?,2
You free  go Saint Paul the day after tomorrow  ?,2
What place on Sunday    ?,2
Nice   7  week early .,1
alright Eggs 10 month before. go Laredo .,1
"No..., I I'm busy.  go get Pasta   two day ahead. .",1
What place suspend  ten year  go Indianapolis  ?,0
When should we meet go get SABA on Tuesday go Berlin  ?,2
What location go get Kits on Thursday go Bridgeport  ?,2
Why not on Saturday go Otawa   ?,2
k go Sacramento Heinz tomorrow .,2
What day should we meet  go get Nesquik on Sunday  ?,2
Sure!  go buy Tic Tac defer  three month  .,0
can't  I have plans already.  go Saint Paul tomorrow  .,2
okay on Tuesday go Innsbruck go buy Dr. Oetker .,2
Let us  late for 3  week House-cleaning products  ?,0
When should we meet see Seven go Worcester 7 month before.  ?,1
When  hold up for 2  week  go Saint Paul  ?,0
When should we meet  postpone one  week   ?,0
Let us  to advance  four month   ?,1
don't I can't.    to advance 1  week .,1
Good today  go Indianapolis .,2
Nah   I have an appointment.  2 year in advance. go get Heinz  .,1
Where do you want go Pittsburgh to advance 2 day Bel Group  ?,1
Let's   go buy Bel Group  nine month ahead.  ?,1
what time go buy Jack Daniels go Reno defer  four year  ?,0
Let us on Wednesday go get Nabisco   ?,2
Do you want 1 year earlier. go Prague   ?,1
Let's  go Springfield postpone  eleven  week go buy Pepsi  ?,0
agree go Scottsdale  the day after tomorrow .,2
Shall we go Memphis hold up for  ten  week go get Candies  ?,0
Are you free at Domino  move to  twelve year  ?,0
exactly go Omaha  on Wednesday .,2
Where we meet  to advance  eihgt day go Ontario  ?,1
You free  move to 8 month SABA   ?,0
Are you busy   go Quebec defer  nine month  ?,0
You free delay for   four month Guaranito   ?,0
agree  nine day in advance. Canned Goods  .,1
Where we  hold up for 6 day go Philadelphia  ?,0
You free  five day in advance.  go buy JNCO  ?,1
can't wait   suspend one year .,0
Do you want tomorrow see Chocolat   ?,2
Yep suspend 6 day go get Cappy  .,0
What time should we meet   seven month before. go Philadelphia  ?,1
what day tomorrow go Indianapolis   ?,2
what time Eggs 10 month before. go Laredo  ?,1
don't  I'll be out of town. go Salem see Black Panther 3 month earlier. .,1
You free  go San Diego DKNY the day after tomorrow  ?,2
Sure!   go get JNCO  six year ahead. .,1
Where we  eihgt day early go Toledo go buy Dry Goods  ?,1
Where should Converse hold up for 6 month   ?,0
Let us 1 day after  go Denver  ?,0
alright 4 year early see Seven  .,1
Do you want Heineken go Phoenix  ten day ahead.  ?,1
Let us 9  week early    ?,1
Sounds good.  go buy Snack foods 9 month advance. go Prague .,1
Let us go Fullerton defer 1  week go get Nabisco  ?,0
Where should  one day later   ?,0
Yep on Tuesday go buy Guinness go Minneapolis .,2
Are you busy    8 day early  ?,1
Are you busy   seven  week early  go Innsbruck  ?,1
Yup go Tallahassee on Saturday  .,2
Yep defer  five month go buy Guinness  .,0
what time   2 year before.  ?,1
Sounds good.   hold up for 10 year go get Bewley's .,0
Where should Granini go Innsbruck  seven  week early  ?,1
Want to   on Wednesday  ?,2
Let's   5 day prior. go Chicago  ?,1
Why not Domino go San Diego 9  week early  ?,1
Where should hold up for  five day go Innsbruck   ?,0
Let us  5 month earlier. go buy DKNY  ?,1
When should we meet go buy Pizza Hut go Madrid on Wednesday  ?,2
Where we meet go Bridgeport go buy Taco Bell on Tuesday  ?,2
Yep  two year prior.   .,1
Are you free at late for 3  week go Berlin   ?,0
of course not I'm busy.    defer  three month .,0
Would you  delay for  7 day   ?,0
Why not today  go Indianapolis  ?,2
alright go Memphis  hold up for  ten  week .,0
Where we go buy Bakery products go Berna  seven  week in advance.  ?,1
When should we meet go buy Pepsi  postpone  eleven  week  ?,0
Where we  go Ontario defer 1 month  ?,0
Sorry.   I'll be out of town. on Thursday  go get Flowers .,2
Yeah... tomorrow go Huntsville  .,2
Nah  I can't.   go Valetta hold up for  three  week .,0
what day tomorrow go Tulsa   ?,2
What time should we meet 9 month advance.    ?,1
Shall we 5 day advance.  go Memphis  ?,1
Would you  2  week earlier.   ?,1
k   8 day early .,1
Where we on Saturday go get Hygiene products   ?,2
Sorry  I have an appointment.  go Fayetteville hold up for  eleven  week  .,0
When  tomorrow Hennessy go Irving  ?,2
what day  today go buy Eggs  ?,2
Yes on Tuesday go get Secret Recipe  .,2
What day should we meet  Cross Colours on Wednesday  ?,2
Yup  on Tuesday go buy Taco Bell .,2
When should we meet on Wednesday    ?,2
Sorry I dont have time  on Wednesday  .,2
nope I'm busy...  go Saint Paul   six month before. .,1
Are you busy    on Thursday  ?,2
Why not   hold up for  three  week  ?,0
Where we one day prior. see The Notebook   ?,1
Yeah... go Henderson see Allied late for 1  week .,0
Sorry  I'll be out of town.  to advance 7 year  .,1
can't wait see Ice Age 1 postpone 3 month  .,0
can't wait  tomorrow  .,2
Shall we  hold up for  ten  week   ?,0
go where  three day earlier.    ?,1
Would you  postpone  seven day   ?,0
What day should we meet go Dallas 4 month earlier.   ?,1
OK  go buy Brahma today .,2
What location go buy Domino go Washington  eihgt year earlier.  ?,1
no way  I have an appointment.  go get House-cleaning products 7 month advance.  .,1
Let us go Phoenix tomorrow go buy Coca Cola  ?,2
 I can't.   go Fayetteville on Monday .,2
exactly  late for 8 year  .,0
How about  go buy Taco Bell  late for 3 day  ?,0
Want to on Tuesday  go get Medicines  ?,2
Let us   seven day before.   ?,1
What location 2 month ahead.    ?,1
Let's  tomorrow go Philadelphia Baby-care  ?,2
Yes go Washington   eihgt year earlier. .,1
Want to  twelve  week earlier.    ?,1
Ok.  on Saturday  go Long Beach .,2
  I have an appointment.  go Amarillo  4 day earlier. .,1
what day  six day prior. Evian   ?,1
No. I dont have time   1 month early .,1
You free  Ecko Unlimited go Rochester on Wednesday  ?,2
Do you want delay for  2 month go Sacramento   ?,0
Shall we   seven month before. Frozen foods  ?,1
Let us the day after tomorrow    ?,2
what time House-cleaning products tomorrow   ?,2
When should we meet  go Boston move to 5 day  ?,0
When   defer 5 month   ?,0
of course not  I have plans already.  move to 2 year   .,0
not I dont have time go Oakland see Mr. Bean's Holiday late for  eihgt year .,0
Why not go get Six Deuce  7 day earlier.  ?,1
Where we  hold up for 5  week   ?,0
Where we go San Diego  six day early   ?,1
Want to go Bridgeport go buy Taco Bell on Tuesday  ?,2
What time should we meet go get Brooks Brothers 8 month earlier.   ?,1
Of course go Berna late for 1 month go buy Angels Jeanswear .,0
Would you go buy Guinness  three year prior.   ?,1
no  I'll be out of town. Eggs  10 month before. .,1
What time should we meet   five month advance.   ?,1
Why not  go Sacramento tomorrow  ?,2
can't wait 1  week advance. go Indianapolis  .,1
You free   ten year before. go buy C&A   ?,1
Sure.   the day after tomorrow Johnnie Walker .,2
You free  ten day early go Tallahassee Hamilton Shirts  ?,1
Want to go Quebec go buy Pepsi  eihgt year early  ?,1
OK!  Mohito  defer  eihgt month .,0
Why not go Fullerton Lavazza on Thursday  ?,2
Sorry.  I'm busy.  go buy Cosmetics suspend  four month go Oklahoma City .,0
When should we meet  two  week advance.  go Glendale  ?,1
Where  late for  eihgt year see Mr. Bean's Holiday  ?,0
You free see Seven go Worcester 7 month before.  ?,1
You free  go buy Grolsch on Monday   ?,2
Are you busy   go buy Wendy's 6 day advance.  ?,1
What place 5  week in advance. go Baltimore   ?,1
No.  I dont have time go Hollywood late for  twelve month  .,0
Why not Bel Group 1 month advance. go Oakland  ?,1
Are you busy   go Berna on Thursday  ?,2
Shall we  nine  week before. go get Secret Recipe go Salt Lake City  ?,1
what day go buy Dry Goods today go Toledo  ?,2
nope I'm busy.  go get Burger King go El Paso suspend 6  week .,0
OK!    the day after tomorrow .,2
No.   I have an appointment.  on Thursday go buy Bel Group go Berna .,2
Yep  ten  week advance. go get Dunkin' Donuts  .,1
Where we Mohito   seven  week after  ?,0
Are you free at  two day prior. see Seven   ?,1
That's right 9  week prior. go Irving Hennessy .,1
What location go buy Coca Cola   five  week later  ?,0
agree go Chicago go get Heinz 2 year in advance. .,1
You free   eleven  week after go buy Strongbow   ?,0
what time   on Friday  ?,2
When  go Prague postpone 3 month   ?,0
What day should we meet go Memphis hold up for  ten  week go get Candies  ?,0
OK on Friday go get Knorr  .,2
Nice 7  week early go buy Lee  .,1
Where we   2 year before.  ?,1
You free go buy Sun-Pat go San Jose on Wednesday  ?,2
Where do you want   five day later go Irving  ?,0
What time should we meet go get Nabisco go Fullerton on Wednesday  ?,2
don't I'm busy.    two month early  .,1
True dat to advance 5 day go get Mustard go New Orleans .,1
Do you want Heinz go Sacramento delay for  2 month  ?,0
What place go New Orleans  eleven day prior. Dr. Oetker  ?,1
alright the day after tomorrow Medicines go Valetta .,2
How about   see Avengers Infinity War 5  week in advance.  ?,1
When should we meet on Saturday go Huntsville go buy Loyandford  ?,2
When should we meet  go Berlin on Tuesday  ?,2
Where  on Tuesday   ?,2
You free  on Sunday    ?,2
Are you free  Koalapop 7 month after   ?,0
yeah  7 day early go Rochester .,1
You free   seven month earlier. go Jersey City  ?,1
True dat  postpone one  week go buy Jack Daniels .,0
Where see Mr. Bean's Holiday  to advance 4 year  ?,1
Sure.  go buy Acorn Stores go Irving on Wednesday .,2
How about  4 day after go buy LEonidas   ?,0
Sure.   late for  nine day  .,0
You free Hamilton Shirts postpone 4  week go Tallahassee  ?,0
Great.  Deep River Rock one year early go Lisbon .,1
Are you busy   suspend  six  week go get Salmon  ?,0
Want to SABA  on Sunday  ?,2
When   late for  six year   ?,0
Are you free at   1 month earlier.  ?,1
Where we meet  late for 3  week   ?,0
Ok.  to advance  two  week   .,1
What day should we meet Mustard go Anaheim tomorrow  ?,2
not  I'll be out of town. go buy Brahma go Glendale one day earlier. .,1
Where should go Minneapolis  6 day advance.  ?,1
can't wait Poultry 5  week prior. go Tulsa .,1
of course not I can't.   move to 10 day  .,0
Why not   three year early go Escondido  ?,1
Are you free   go buy Candies on Tuesday  ?,2
Shall we go Saint Paul go get Cappy tomorrow  ?,2
don't  I have an appointment.  one year after   .,0
what day 9 year earlier. go Indianapolis   ?,1
Let us hold up for 2  week    ?,0
Where we  go buy Toys  three  week advance.  ?,1
Are you free at Heineken  ten month later go Phoenix  ?,0
Are you busy  9 year earlier. Kinder   ?,1
Where do you want go get Magnum  nine day early   ?,1
Why not go get Burger King today   ?,2
don't  I have plans already.   on Sunday  .,2
Where go buy Highland Spring go Denver on Monday  ?,2
Where go Charlotte  the day after tomorrow  ?,2
nope  I have an appointment.  on Tuesday  go get Medicines .,2
Are you busy   go Hayward  nine day early  ?,1
Where delay for  2 month  Heinz  ?,0
Want to   on Sunday  ?,2
How about  go Bellevue  tomorrow  ?,2
What day should we meet    nine  week in advance.  ?,1
No. I dont have time on Saturday   .,2
Are you free at  defer  eihgt month   ?,0
Let us Juicy Juice  2 year before.  ?,1
Great.   to advance 2 day go Pittsburgh .,1
What day should we meet 1 month early  go get Merc Clothing  ?,1
Yes  late for 3 year  .,0
No.  I'll be out of town. go buy Loyandford on Saturday  .,2
Let's  go Pittsburgh postpone  nine month Bel Group  ?,0
Sure.    on Friday .,2
What day should we meet 10 month after Mataano   ?,0
Of course to advance  four month  go Albuquerque .,1
What location  go Philadelphia 2 month ahead.  ?,1
Yup   on Tuesday .,2
k today go get Burger King go El Paso .,2
No.  I'm busy...    tomorrow .,2
What location   6 year early  ?,1
No.  I'm busy.    nine  week prior.  .,1
Yup hold up for  five day go Innsbruck  .,0
Sorry.   I have an appointment.    on Tuesday .,2
Where should  on Sunday   ?,2
don't I can't.  hold up for  five month   .,0
no way  I have plans already.  go Fayetteville 4 year before.  .,1
Where go get McDonald's  tomorrow  ?,2
Yep go Hayward  nine day early go get Magnum .,1
Where  two day ahead.    ?,1
Where we   on Tuesday  ?,2
Yes   five month advance.  .,1
of course not I'm busy.  1  week advance. go Indianapolis  .,1
can't I can't.  5 year advance. go get Bel Group go El Paso .,1
Why not  go get Kinder to advance  two day  ?,1
Yes  2  week earlier.  .,1
can't wait    twelve  week early .,1
exactly  twelve  week earlier.  go Escondido .,1
alright  Medicines delay for   ten day .,0
Where we meet   postpone  nine year  ?,0
Would you   eihgt  week earlier. go buy Loyandford  ?,1
Are you free at  two day prior.    ?,1
You free go Toledo  eihgt  week ahead. go get Dry Goods  ?,1
Are you busy   four day earlier. go Glendale go buy Brahma  ?,1
what time go buy Knorr on Monday   ?,2
no way  I have an appointment.  on Sunday  go Houston .,2
OK the day after tomorrow Kits  .,2
Want to go Fayetteville hold up for 6 year   ?,0
no  I have an appointment.  on Saturday go Quebec go buy Pepsi .,2
Yes defer 1  week   .,0
Where do you want suspend 5  week  go San Diego  ?,0
When   eleven year before. go Prague   ?,1
Where should 1 month advance.    ?,1
Shall we  late for 10 day   ?,0
Why not tomorrow  go New Orleans  ?,2
Yup postpone 4  week   .,0
Would you  defer  eihgt  week   ?,0
Sounds good.  go get Bewley's  three day in advance.  .,1
Nice  suspend  two year go St. Louis .,0
Are you free at 7  week in advance. go Wien go get Nesquik  ?,1
What location House-cleaning products go Henderson tomorrow  ?,2
Where should  nine month later go buy Candies   ?,0
No. I can't.  defer  five month   .,0
What day should we meet today go Chicago go get Salmon  ?,2
Are you free at  twelve  week earlier.  go Escondido  ?,1
what time Personal hygiene  defer 10 year  ?,0
Where should go Worcester on Sunday   ?,2
"No..., I  I have an appointment.    seven month earlier. go Jersey City .",1
Shall we go get Pasta on Thursday go Santa Ana  ?,2
What time should we meet  8 month earlier. go buy Forever Lazy  ?,1
Why not Hennessy postpone 4 day go Irving  ?,0
Are you free at delay for  9 year go San Antonio   ?,0
OK  late for  twelve month go get Diet foods .,0
What time should we meet go buy Evian   seven month in advance.  ?,1
Let us delay for   eihgt month  go get McDonald's  ?,0
Sorry I dont have time go San Jose on Wednesday  .,2
Let's   go Pittsburgh  five year before.  ?,1
You free  8 month earlier. go Columbus  ?,1
k   ten year ahead. go Sacramento .,1
Where should go Oakland Converse on Tuesday  ?,2
You free go Denver suspend one year go buy Tanqueray  ?,0
Where do you want   suspend  nine  week  ?,0
what day see Seven go Irving suspend 10  week  ?,0
k 7 year prior.  go buy Pepsi .,1
what day 7  week advance. go Washington   ?,1
Good  postpone 8 year go buy Mohito .,0
Where do you want go Oklahoma City  on Tuesday  ?,2
Where we meet suspend 8 day go Pittsburgh go buy Grolsch  ?,0
Good    nine month ahead. .,1
Yup go get Dry Goods   eihgt  week ahead. .,1
no way I dont have time go buy Healthtex  tomorrow .,2
Sorry.   I have an appointment.    to advance  seven  week .,1
What day should we meet go Chicago the day after tomorrow   ?,2
When   eihgt month after  go Quebec  ?,0
Why not hold up for  three year go Pittsburgh go get Six Deuce  ?,0
Want to  go get Papadopoulos suspend 6 month  ?,0
can't wait  8 month before.  .,1
When   Flowers on Monday  ?,2
of course not I'm busy.  go Otawa   three year prior. .,1
no I dont have time go buy Ex-Boyfriend  4 day ahead. .,1
When     twelve day before.  ?,1
That's right  go Wien hold up for 8 day .,0
Want to go get Absolut  ten day after   ?,0
You free  go Glendale go buy Snack foods 1 year later  ?,0
Why not    eleven year before.  ?,1
Want to  suspend  eihgt day   ?,0
Yes  five month after go Springfield go get Andy Capp's fries .,0
When should we meet   seven month earlier. see Transformers  ?,1
go where 5 month early    ?,1
You free go Nashville  five day in advance. go buy JNCO  ?,1
Sure!  Max Studio go Glendale on Wednesday .,2
What day should we meet   hold up for  six year  ?,0
go where delay for   ten  week go Lincoln   ?,0
Shall we   eleven month later go buy Brahma  ?,0
What location  go get Merc Clothing on Sunday  ?,2
When    seven year early go Hollywood  ?,1
Why not  Mustard tomorrow  ?,2
alright Domino on Saturday  .,2
When should we meet see Blood Diamond go Oakland  eleven month before.  ?,1
Where should 7 month after Koalapop go Nashville  ?,0
Sure.  9  week early Domino  .,1
Where we hold up for 6 day Baby-care go Philadelphia  ?,0
go where 5 day after  go Laredo  ?,0
nope I'm busy.    one  week later .,0
Where do you want  9 month later White rice  ?,0
What place on Saturday go New York Personal hygiene  ?,2
Why not go Miami 2 year later Cross Colours  ?,0
Would you on Saturday go Otawa go buy Guinness  ?,2
Want to tomorrow go Madrid   ?,2
You free    six month early Baby-care  ?,1
What time should we meet to advance  three year    ?,1
Shall we go Salt Lake City go get Secret Recipe 6 month after  ?,0
How about    on Sunday  ?,2
alright   on Wednesday .,2
go where 5 day after Eggs   ?,0
Nah  I'm busy.  go Columbus hold up for  eleven month go buy Forever Lazy .,0
How about    1 month early  ?,1
Are you busy  today  go buy Kits  ?,2
How about  on Tuesday go get Secret Recipe   ?,2
Why not go Glendale  postpone  four month  ?,0
go where to advance 10 day go get Meat   ?,1
No.   I have an appointment.  go get Cappy 7  week advance. go Washington .,1
go where go Bucharest  6 day after  ?,0
reject  I have plans already.  see Seven  suspend 10  week .,0
Shall we suspend  six day Nudie Jeans go Ontario  ?,0
go where  ten day ahead. go Phoenix   ?,1
what day   to advance  seven month  ?,1
go where  to advance 7 year   ?,1
Are you free at   tomorrow  ?,2
of course not  I'll be out of town. Koalapop  ten month advance.  .,1
Are you free  go Lincoln on Tuesday go get Lee  ?,2
yeah  go get Nesquik 7  week in advance. .,1
of course not  I have plans already.  8 day advance.   .,1
go where go Fullerton   three day earlier.  ?,1
Would you go Jersey City on Monday see Transformers  ?,2
of course not I can't.   move to 8 month  .,0
Where we go Saint Paul  three  week advance. go buy Toys  ?,1
Where we  go Charlotte one day prior.  ?,1
Of course move to 8 month  go get Medicines .,0
Where postpone 4  week    ?,0
When  see Chocolat to advance  two  week go Fayetteville  ?,1
Where we go buy Juicy Juice on Tuesday go Tulsa  ?,2
Where we  seven  week in advance.  go buy Bakery products  ?,1
What location 2  week earlier.  go buy Kits  ?,1
what day 1 year earlier. go Prague   ?,1
Yes the day after tomorrow go Lyon  .,2
no  I have plans already.  7 year prior. go Springfield go buy Pepsi .,1
Would you 5  week prior.  Poultry  ?,1
go where go buy Tic Tac defer  three month   ?,0
Do you want 5 day after Eggs   ?,0
no I can't.  go buy C&A move to  nine  week go Escondido .,0
agree  late for 7 month go Berna .,0
When should we meet suspend 7 month go buy Baby-care go Santa Ana  ?,0
Want to   ten day after   ?,0
Where we meet go Bridgeport go buy Taco Bell 4  week prior.  ?,1
No. I'm busy...    hold up for 6 day .,0
